comment,blacklist_suggestions,overall_quality,factual_correctness,readability,rating_time,warm_up,user_suggestions,action_coherence,linguistic_difference,content_similarity,identical_information,exhaustive_information,story_edit,story_old,grammar,implicit_fact_check,citation_correct,context_realization,false_gender,false_mood,matches_fandom,positive_comment,positive_example,negative_comment,negative_example,implicit_fc_comment,implicit_fc_example,positive_comment_topic,negative_comment_topic,story_id,listvalue,story_group,length,topk,temperature,likelihood_score,hash,version,amount_fallbacks,duration_generation,dur_score,user,date
-1,-1,70,100,75,15:19,0,-1,100,70,100,75,100,-1,-1,100,100,100,-1,100,100,-1,wenig Fehler,-1,Ein Wort eingeschoben&comma; welches keinen Sinn ergibt,&quot;Ich bin nicht Bundestrainer. Es ist nicht an mir zu beurteilen&comma; ob es schon reicht für die Nationalmannschaft&quot;&comma; sagte der Niederländer: &quot;Aber ich arbeite ungefähr seit einem Jahr mit diesem Jungen.  Output: &quot;Ich bin nicht Bundestrainer. Es ist nicht an mir zu beurteilen&comma; ob es schon reicht für die Nationalmannschaft&quot;&comma; erklärte der Niederländer. Und: &quot;Aber ich arbeite ungefähr seit einem Jahr mit diesem Jungen,-1,-1,-1,-1,105423,2,,,,,,a0044d21e2906d5720d3195ded5c14ef,,1,34.023.295.640.945.400,1.499.060.869.216.910,70828,2022-09-25 12:16:42
-1,-1,80,100,100,14:59,0,-1,100,70,100,100,100,-1,-1,100,100,100,-1,100,100,-1,sehr schön umgestellter Satz,Deutschland.  Input: Die Bundesregierung in Berlin hat das Nachbarland zum Virusvariantengebiet erklärt.  Output: Das Nachbarland wurde von der Bundesregierung in Berlin als Virusvariantengebiet eingestuft. ,-1,-1,-1,-1,-1,-1,105389,1,,,,,,43126f6e74b74a9a65f648f3d41339cf,,0,3.538.763.189.315.790,17.835.509.300.231.900,70828,2022-09-25 12:31:48
-1,-1,60,100,75,19:43,0,-1,100,70,90,75,75,-1,-1,90,100,100,-1,100,100,-1,-1,-1,unpassende hinzugefügte Wörter,Input: Es gehe darum&comma; auch in der Pandemie an die Zukunft zu denken&comma; sagte der SPD-Politiker am Freitag im Bundestag.  &quot;Ganz konkret tun wir deshalb an dieser Stelle etwas&comma; um diejenigen zu unterstützen&comma; die jetzt noch durchhalten müssen: Output: Der SPD-Politiker sagte am Freitag im Bundestag&comma; es sei wichtig&comma; auch an die Zukunft in der Pandemie zu denken.  Aber: &quot;Ganz konkret tun wir deshalb an dieser Stelle etwas&comma; um diejenigen zu unterstützen&comma; die jetzt noch durchhalten müssen: ,-1,-1,-1,-1,105461,3,,,,,,3d2e80d599baa7e98a1fa0cf1fd1a7c2,,0,20.209.988.832.473.700,16.263.169.050.216.600,70828,2022-09-25 12:51:33
-1,-1,70,100,75,12:58,0,-1,100,70,100,100,100,-1,-1,100,100,100,-1,100,100,-1,keine inhaltlichen Fehler,-1,Ausdruck Fehler,Bestandsdaten umfassen keinen Inhalt etwa von Anrufen oder E-Mails&comma; sondern auch keine Verkehrsdaten&comma; aus denen zum Beispiel ersichtlich ist&comma; wer wann mit wem telefoniert hat. ,-1,-1,-1,-1,105433,2,,,,,,dbf230d8d7e507edfa85cbcba730b0e6,,0,3.469.327.926.635.740,15.689.248.085.021.900,70828,2022-09-25 13:04:33
-1,-1,100,100,100,1:8,1,-1,100,40,100,100,100,-1,-1,100,100,100,-1,100,100,-1,-1,-1,-1,-1,-1,-1,-1,-1,105427,2,,,,,,89e4a0321568c594238a1252564dfde3,,0,24.356.505.632.400.500,1.147.329.592.704.770,50504,2022-09-25 13:09:11
-1,-1,70,100,50,2:26,1,-1,100,60,90,100,100,-1,-1,90,100,100,-1,100,100,-1,-1,-1,1. G&R &quot;den Standards&quot;2. Ausdruck 3. aufgrund des fehlenden &quot;oders&quot; Ausdruck und nahezu IFC,1.  es seien keine der FFP2-Standards entsprechenden Masken verteilt worden 2. Und: 3. Die Masken könnten bei der Stadt über einen Zwischenhändler angekommen sein&comma; es könne sich um eine Spende gehandelt haben. ,-1,-1,-1,-1,105369,1,,,,,,dd4654974a86a92aec341b8b8a6ddab5,,0,2.420.033.836.364.740,10.526.456.832.885.700,50504,2022-09-25 13:11:39
-1,-1,70,100,75,12:8,0,-1,100,60,90,100,100,-1,-1,90,75,100,-1,100,100,-1,-1,-1,-1,-1,-1,-1,-1,-1,105373,1,,,,,,3976085f6cf9209836e1e24ca54bfab3,,1,3.355.305.528.640.740,1.409.648.084.640.500,70828,2022-09-25 13:16:41
-1,-1,50,100,100,6:46,1,-1,75,50,90,100,100,-1,-1,30,75,90,-1,-1,100,-1,-1,-1,1. G&R&comma; weil beide Sätze zusammengehören und &quot;des Internationalem Währungsfonds&quot; 2. G&R Hilfsverb &quot;werden&quot; fehlt3. G&R Kasus &quot;einem &quot;Mord&quot;...4. Präp. &quot;von&quot;&comma; aber ist diskutabel5. Genusfehler6. Die KI verdreht in letzter Zeit die Reihenfolge von Teilsätzen und zerstört dadurch LKH&comma; änder IFC und IA,1. Der frühere Direktor von Internationalen Währungsfonds (IWF)&comma; der wegen Unterschlagung von Bankgeldern verurteilt wurde. Rodrigo Rato ist nach Medienberichten in Spanien nach über zwei Jahren hinter Gittern vorzeitig auf freiem Fuß. 2. Rato war Ende Oktober 2018 in das Gefängnis von Soto del Real&comma; 40 Kilometer nördlich von Madrid&comma; eingewiesen. 3. ein &quot;Mord ohne Mörder&quot;. 4. Nach einem Börsengang von Bankia in 2011 5. 2012 wurde es teilverstaatlicht.  6. Spanien beantragte ein europäisches Rettungspaket über 41 Milliarden Euro&comma; wie der Beinahe-Zusammenbruch erklärte.    ,-1,-1,-1,-1,105440,3,,,,,,b90102599863bf1f4ad8099e0d48d184,,0,7.145.075.416.564.940,6.573.817.205.429.070,50504,2022-09-25 13:18:31
-1,-1,60,100,75,2:29,1,-1,100,50,90,100,100,-1,-1,80,100,100,-1,100,100,-1,-1,-1,1. wie oft in letzter Zeit Großschreibung mitten im Satz2. Ausdruck &quot;stattgegeben&quot;3. G&R Satzstellung,1.  dürfen Zwei Berliner Kliniken  2. Den Eilanträgen der Notfall-Krankenhäuser wurde damit statt gemacht. 3.  Den Kliniken&comma; die meinten&comma; müssten sie das Verbot nicht beachten&comma; folgte das Gericht nun,-1,-1,-1,-1,105471,3,,,,,,810fe5ea996ed15c4a3980677d81628d,,0,2.027.767.515.182.490,1.648.361.611.366.270,50504,2022-09-25 13:21:10
-1,-1,60,100,50,4:18,0,-1,100,70,80,100,100,-1,-1,80,50,100,-1,-1,100,-1,-1,-1,1. Ausdruck2. Ausdruck3. Ausdruck wegen Präposition und IFC&comma; IA4. G&R Satzstellung5. Genus,1. Oppositionsamt 2.  lag im Zusammenhang 3. nach Minsk entführt 4.  zum Präsidenten erneut erklären lassen 5. Auch die EU erkennt die 66-Jährige nicht mehr als Präsident an. ,-1,-1,-1,-1,105414,2,,,,,,eb12ee722fe94a30a11e06a81b7492ea,,0,4.816.125.440.597.530,22.216.922.760.009.700,50504,2022-09-25 13:25:29
-1,-1,60,100,50,3:53,0,-1,100,60,70,100,75,-1,-1,80,50,100,-1,100,100,-1,-1,-1,1. G&R Satzstellung2. Ausdruck &quot;hauptsächlich&quot; / &quot;oberflächlich&quot; und somit auch Vollständigkeit (auf IFC verzichte ich&comma; weil das Wort in diesem Kontext keinen Sinn ergibt)3. Ausdruck Verb,1. Für den Impfstart mit Sputnik V je fünf sollten 560 Hausärzte Patienten im Alter von 60 bis 74 benennen&comma; die an keinen Vorerkrankungen leiden. 2. Die Gesundheitsbehörden hätten ihre Überprüfung hauptsächlich und intransparent durchgeführt&comma; bemängeln Ärzte und Fachleute. 3. Außenminister Peter Szijjarto hält das Vorliegen der Bedingungen fest. ,-1,-1,-1,-1,105341,1,,,,,,89a78a66fe73531c308a3201ce640182,,0,4.676.932.334.899.900,25.630.800.247.192.300,50504,2022-09-25 13:29:24
-1,-1,60,100,50,3:10,0,-1,100,50,90,100,100,-1,-1,60,100,100,-1,100,100,-1,-1,-1,1. G&R2. G&R Kasus3. Ausdruck best. Artikel4. Ausdruck,1.  Ein weiterer 65 werde in Krankenhäusern behandelt&comma; sagte ein Sprecher des örtlichen Rettungsdienstes MedStar am Donnerstagabend (Ortszeit). 2. Es sei aber anzunehmen&comma; dass die Karambolage von Eis und überfrierenden Regen ausgelöst wurde. 3. Der Zustand der drei Opfer sei kritisch. 4. Die Massenkarambolage ereignete sich in der morgendlichen Berufsbewegung.  ,-1,-1,-1,-1,105432,2,,,,,,e305dfa0114bc2d4f55ea07b48978b25,,0,3.913.828.682.899.470,20.238.479.375.839.200,50504,2022-09-25 13:32:39
-1,-1,60,100,75,2:50,0,-1,100,50,90,100,100,-1,-1,50,100,100,-1,100,100,-1,-1,-1,1. G&R Präposition2. G&R Komma statt Punkt und Ausdruck wegen Satzstellung3. G&R Hilfsverb fehlt erneut beim Tempus4. G&R &quot;es&quot; fehlt&comma; was zuvor schon mehrfach vorkam,1. Beim Grand-Slam-Turnier in Melbourne trifft Djokovic nun beim an Nummer 14 gesetzten Kanadier Milos Raonic. 2. Im Achtelfinale an diesem Sonntag trifft der 23 Jahre alte Hamburger auf Djokovics Landsmann Dusan Lajovic; 3. Die Rod-Laver-Arena musste um 23.30 Uhr Ortszeit von allen Zuschauern verlassen. 4. Aus Djokovics Sicht stand zu diesem Zeitpunkt 7:6 (7:1)&comma; 6:4&comma; 3:6&comma; 2:3. ,-1,-1,-1,-1,105345,1,,,,,,4841925e4d6b6492224d9790a69e479e,,0,40.049.506.425.857.500,2.169.455.885.887.140,50504,2022-09-25 13:35:30
-1,-1,50,100,0,4:0,0,-1,100,70,80,100,100,-1,-1,70,75,90,-1,100,100,-1,-1,-1,1. Ausdruck best. Artikel2. Ausdruck Passiv3. Ausdruck unbest. Artikel4. Ausdruck &quot;der Retter&quot;5. G&R Zitation6. G&R Satzstellung,1. Der Zustand der drei Opfer sei kritisch gewesen.  2. Es solle aber angenommen werden&comma; dass die Karambolage durch Eis und überfrierenden Regen verursacht wurde. 3. Im morgendlichen Berufsverkehr ereignete sich eine Massenkarambolage. 4. Die eisglatte Straße habe die Arbeit von Rettern behindert. 5. Nach Angaben des MedStar-Sprechers &quot;Dies ist ein Ereignis&comma; für das unsere Behörden zwar trainieren&comma; wir aber hoffen und dafür beten&comma; dass es nie passiert&quot;. 6. Mindestens drei kamen laut dem Sender CNN weitere Menschen bei weiteren Unfällen auf spiegelglatten Straßen in Texas ums Leben.  ,-1,-1,-1,-1,105482,3,,,,,,df5f6ecd08664c0470da951de0b0aea0,,0,2.937.604.284.286.490,2.462.659.525.871.270,50504,2022-09-25 13:39:35
-1,-1,40,100,0,5:30,0,-1,100,60,70,100,75,-1,-1,90,50,100,-1,100,100,-1,-1,-1,1. Ausdruck (weil hier das &quot;um&quot; den Sinn verändert)&comma; Vollständigkeit (im Ringen)&comma; IFC&comma; IA2. Ausdruck unbest. Artikel3. Ausdruck &quot;kein&quot;4. Ausdruck&comma; IFC&comma; IA&comma; soll / will5. Ausdruck es / das und best. Artikel statt &quot;mit stärkerem Wettbewerb&quot;6. G&R Präp,1. Die Bundesregierung bekommt Gegenwind aus den Ländern&comma; um TV-Kosten aus der Nebenkostenabrechnung der Mieter zu streichen. 2. Es geht um eine sogenannte Umlagefähigkeit 3. oder nicht Fernsehen schauen. 4. Um mehr Wettbewerb zu erzeugen&comma; soll die Bundesregierung diese Regelung kippen. 5. Das Bundeswirtschaftsministerium sieht es anders – die Behörde rechnet mit dem stärkeren Wettbewerb&comma; es werde &quot;vielfältigere&comma; günstige Angebote&quot; geben. 6. dann kommt das Gesetzgebungsvorhaben zum Bundestag. ,-1,-1,-1,-1,105394,2,,,,,,c847b438affdd49360df1c8acc8ae445,,0,45.056.488.275.527.900,21.032.799.243.927.000,50504,2022-09-25 13:45:06
-1,-1,60,100,50,2:20,0,-1,100,70,80,100,100,-1,-1,80,100,100,-1,100,100,-1,-1,-1,1. Ausdruck Satzstellung (ist bei G&R ja nicht einmal zwingend falsch)2. Ausdruck bekannt geben und G&R Großschreibung3. G&R geholt,1. Sie kann an diesem Freitag in der Mixed-Staffel nicht mit Martin Nörl an den Start gehen&comma; weil sich Jana Fischer bei den Titelkämpfen im schwedischen Idre Fjäll im Einzelevent eine leichte Gehirnerschütterung zugezogen hatte.  2.  Das teilte Snowboard Germany Wenige Stunden vor Beginn bekannt. 3. Am Donnerstag wurden Nörl (Adlkofen) und Berg (Konstanz) jeweils Fünfte und Sechste geholt,-1,-1,-1,-1,105350,1,,,,,,0e4030169c16be0629d39fe73ecf39ad,,1,30.971.713.542.938.200,1.682.649.803.161.620,50504,2022-09-25 13:47:27
-1,-1,30,100,25,33:37,0,-1,100,80,90,100,75,-1,-1,0,75,100,-1,100,100,-1,-1,-1,1. Ausdruck Satzstellung Relativsatz2. G&R Satzstellung &quot;am Freitag&quot;3. Ausdruck4. G&R und Vollständigkeit / IFC / IA&comma; weil &quot;er&quot; fehlt6. G&R Satzstellung7. G&R Genitiv-S8. G&R Komma und Kasus und Ausdruck &quot;der Mann&quot;,1. Mit Sorge blicken Vertreter tschechischer Berufspendler auf die geplanten verschärften Einreiseregeln nach Deutschland&comma; die in der Bundesrepublik arbeiten. 2. Jan Triska von der tschechischen Pendlervereinigung APCR forderte finanzielle Hilfen für diejenigen Arbeitskräfte am Freitag&comma; 3. Die Pendler würden Steuern und Sozialabgaben in Deutschland zahlen&comma; wies er hin. 4. Die Deutschen Presse-Agentur&comma; sagte &quot;Es 6. Über die Grenze rechnet er damit&comma; dass nur medizinisches Personal und Mitarbeiter kritischer Infrastruktur gelassen werden. 7. Nach Einschätzung von Triskas 8. Testzentrum&quot; zählte den Mann auf,-1,-1,-1,-1,105489,3,,,,,,4c5a192e47bf8b17ed6cad2399e0452c,,0,26.950.005.054.473.800,22.999.022.483.825.600,50504,2022-09-25 14:21:06
-1,-1,90,100,50,3:29,0,-1,100,70,90,100,100,-1,-1,90,100,100,-1,100,100,-1,-1,-1,1. G&R Präposition2. Hier bin ich unsicher&comma; weil ich auch aus dem IP nicht weiß&comma; ob es eine Neugründung oder eine Erneuerung eines uralten Preises ist&comma; der zeitweilig aufgegen wurde  3. Ausdruck best. Artikel,1.  wo er in Frankfurt geboren wurde. 2.  1947 wurde die Goetheplakette vom Magistrat der Stadt Frankfurt am Main wieder gegründet. 3. sagte die Sprecherin des Kulturdezernats. ,-1,-1,-1,-1,105410,2,,,,,,624ab1c6ebf09ec33d5b962b554608e6,,0,2.374.609.684.944.150,10.593.913.555.145.200,50504,2022-09-25 14:24:36
-1,-1,90,100,50,1:58,0,-1,100,40,100,100,100,-1,-1,100,100,100,-1,100,100,-1,-1,-1,1. Ausdruck unbest. Artikel2. Ausdruck Satzstellung,1. eines zum Teil giftigen Löschwassers  2. Die insgesamt 5000 Quadratmeter große Fabrikhalle brannte in der Nacht voll mit Behältern aus Säuren und Laugen. ,-1,-1,-1,-1,105342,1,,,,,,26e309f43066d2f05423bdc787e74f13,,0,2.939.648.199.081.420,14.603.731.870.651.200,50504,2022-09-25 14:26:36
-1,-1,10,100,100,13:12,0,-1,100,50,80,100,100,-1,-1,20,100,90,-1,100,100,-1,-1,-1,1. G&R2. G&R Präposition3. G&R Kasus und erfundenes direktes Zitat ohne AFZ4. G&R Leerzeichen und Satzzeichen,1. sein Personal Rochaden stark verteidigt. 2. am Sonntag (18.00) gegen Sky. 3.  Wenn dir ein anderer Klub&comma; ein Spieler oder ein Trainer wegholt&comma; kann man natürlich einen Groll haben. 4.  geholt&quot; >&comma;  ,-1,-1,-1,-1,105455,3,,,,,,ff5d5f55d59c9a11439a95acec4d76ad,,0,19.695.130.109.786.900,16.283.315.896.987.900,50504,2022-09-25 14:39:49
-1,-1,60,100,75,20:1,0,-1,100,50,80,100,100,-1,-1,70,50,100,-1,100,100,-1,-1,-1,1. G&R Komma. Beim Eigennamen &quot;Eintracht&quot; hat die KI immer Probleme bislang2. Ausdruck wollen / werden3. G&R Doppelpunkt zwischen Vor- und Nachname4. G&R Präp. und daher IFC&comma; IA,1. Eintracht&comma; Frankfurts Trainer Adi Hütter sieht den Gegner wegen der aktuellen Erfolgsserie als sehr motiviert an.  2. werden den Lauf am Sonntag (15.30 Uhr / Sky) gegen den 1. FC Köln fortsetzen. 3.  Aymen: Barkok 4. Nach dem kurzfristigen Ausfall des Gastspiels  ,-1,-1,-1,-1,105428,2,,,,,,86f3ae2fc11c7c9298c71f710234a9b6,,0,3.561.664.366.722.100,2.143.607.187.271.110,50504,2022-09-25 14:59:51
-1,-1,60,100,75,2:15,0,-1,100,50,90,100,100,-1,-1,70,75,100,-1,100,100,-1,-1,-1,1. Ausdruck Satzstellung2. G&R falsches &quot;und&quot;3. G&R Präp.4. Genus,1. Ein Bayreuther Friseur will diesen jetzt für einen guten Zweck versteigern&comma; weil der Andrang auf einen ersten Termin nach dem Lockdown enorm ist. 2. Er habe mehr als 150 Anrufe erhalten und seit klar sei&comma; dass er am 1. März wieder öffnen dürfe&comma; teilte Friseur Andreas Nuissl (57) am Freitag auf Anfrage mit. 3. Das höchste Gebot lag am frühen Freitagnachmittag mit 282 Euro. 4. die 57-Jährige,-1,-1,-1,-1,105349,1,,,,,,3c411689f44b2719f79623d98dfe1a42,,0,3.205.979.657.173.150,15.659.706.354.141.200,50504,2022-09-25 15:02:13
-1,-1,90,100,100,0:48,0,-1,100,50,90,100,100,-1,-1,100,100,100,-1,100,100,-1,-1,-1,-1,-1,-1,-1,-1,-1,105446,3,,,,,,e80f1859418d1f012a3169f655a5578b,,0,1.061.205.005.645.750,8.483.702.659.606.930,50504,2022-09-25 15:03:03
-1,-1,80,100,50,2:1,0,-1,100,40,90,100,100,-1,-1,90,100,100,-1,100,100,-1,-1,-1,1. Ausdruck2. Ausdruck3. G&R fehlendes Komma,1. Denn: &quot; 2. Und:  3. nachvollziehbar&quot; erklärte Heimlich,-1,-1,-1,-1,105419,2,,,,,,752c063276823c7607e903557b5c734c,,0,23.021.640.062.332.100,9.684.564.113.616.940,50504,2022-09-25 15:05:06
-1,-1,70,100,75,2:25,0,-1,100,50,90,100,100,-1,-1,70,75,100,-1,100,100,-1,-1,-1,1. G&R Leerzeichen2. G&R Leerzeichen3. G&R Hilfsverb fehlt beim Tempus4. Ausdruck Adverb und deshalb IFC&comma; IA,1.  &quot;Spiegel&quot; -Bericht 2. &quot;Spiegel&quot; -Informationen 3. Nach einem &quot;Spiegel&quot; -Bericht sind seit Jahresbeginn bereits 3800 Soldaten gegen das Coronavirus geimpft. 4. Die Impfstoffe hätten dann vernichtet werden müssen. ,-1,-1,-1,-1,105347,1,,,,,,47806a8dbafdfd4f759c21299b5bbac0,,0,2.015.132.188.796.990,6.686.355.113.983.150,50504,2022-09-25 15:07:37
-1,-1,60,100,50,2:59,0,-1,100,50,90,100,100,-1,-1,60,100,100,-1,100,100,-1,-1,-1,1. Ausdruck Satzstellung2. Ausdruck und G&R Großschreibung3. G&R Präp.4. G&R Komma5. G&R Konjunktion VerbDas sind fast alles Fehler&comma; die so oder ähnlich an denselben Stellen bereits mehrfach zuvor bei diesem IP auftraten,1. An diesem Freitag kann sie nicht zusammen mit Martin Nörl in der Mixed-Staffel antreten&comma; weil Jana Fischer sich eine leichte Gehirnerschütterung bei den Titelkämpfen im schwedischen Idre Fjäll im Einzelevent zugezogen hatte. 2. Es kam von Snowboard Germany Wenige Stunden vor der Teilnahme bekannt. 3. Bei einem Sturz hatte sich die Sportlerin von SC Löffingen in Baden-Württemberg im Donnerstag verletzt. 4. gefällt&quot; sagte Cheftrainer Bernard Loer. 5.  Mannschaftsgold sicherte sich vor den Mixed-Teams von Italien und Frankreich die Australier Belle Brockhoff und Jarryd Hughes. ,-1,-1,-1,-1,105450,3,,,,,,81a581dad1c358e2cf388a43d573e940,,0,2.627.591.347.694.390,23.036.064.386.367.700,50504,2022-09-25 15:10:37
-1,-1,60,100,25,3:20,0,-1,100,60,80,100,100,-1,-1,70,50,100,-1,-1,100,-1,-1,-1,1. Ausdruck Satzstellung2. G&R und Ausdruck&comma; Präposition und Satzstellung (Uhrzeit)&comma;daher auch IFC und IA3. Ausdruck sollen / wollen&comma; IFC&comma; IA4. G&R Präp.5. Genus,1. Ein Bayreuther Friseur will diesen jetzt für einen guten Zweck versteigern&comma; weil der Andrang zum ersten Termin nach dem Lockdown groß ist.  2. Nach dem ersten freien Termin im 1. März wurde immer wieder um 8.00 Uhr gefragt 3. Anschließend soll Nuissl das Schlussgebot an die Tafel Bayreuth und eine Hilfsorganisation spenden&comma; 4. unter 282 Euro. 5. Für 500 Euro&comma; das Nuissl ebenfalls spenden will ,-1,-1,-1,-1,105449,3,,,,,,d2a151056d235377a82aabedec5a9ece,,0,24.016.291.856.765.700,20.065.550.804.138.100,50504,2022-09-25 15:14:05
-1,-1,10,100,0,5:35,0,-1,100,50,80,100,100,-1,-1,40,75,100,-1,100,100,-1,-1,-1,1. Ausdruck abziehen / zurückziehen2. G&R Reflexivpronomen fehlt3. G&R &quot;ihn&quot; fehlt4. Ausdruck5. Ausdruck Einleitung direkte Rede6. Ausdruck unbest. Art.7. G&R Tempus8. Ausdruck Verb9. G&R &quot;führen&quot;10. G&R Präp.11. Ausdruck11. Ausdruck &quot;denn&quot;&comma; Satzstellung G&R,1. Wegen einer Brustkrebserkrankung seiner Ehefrau zieht sich Baden-Württembergs Ministerpräsident Winfried Kretschmann zeitweise aus dem laufenden Wahlkampf bei der Landtagswahl ab. 2. Die dpa hatte zunächst den Eindruck erweckt&comma; dass Kretschmann ganz aus dem Wahlkampf zurückziehe. 3. Dafür ersetzt Grünen-Landtagsfraktionschef Andreas Schwarz. 4. &quot;Meine Frau Gerlinde ist an Brustkrebs erkrankt&quot;&comma; sagte Kretschmanns persönliche Erklärung. 5. Aber: 6. in einem Wahlkampf 7.  Er versichert: 8. CDU-Kultusministerin Susanne Eisenmann will Kretschmann bei der Wahl zum 14. März herausholen. 9. Vor der CDU führt die Grünen in jüngsten Umfragen.  10. sagte Eisenmann beim Freitag. 11.  Aber: &quot; 12.  denn nun da beide den Schritt gegangen seien&comma; die Erkrankung öffentlich zu machen.  ,-1,-1,-1,-1,105375,1,,,,,,2491f2ebbe2f0866add57122b75ad0b1,,0,4.321.849.179.267.880,18.696.088.552.474.900,50504,2022-09-25 15:19:45
-1,-1,70,100,100,1:53,0,-1,100,50,90,100,100,-1,-1,60,100,100,-1,100,100,-1,-1,-1,1. G&R Präp. 2. G&R3. G&R Plural,1. bei Aufstiegskurs 2. des Osnabrücks Verteidiger  3. Es war für den Lila-Weißen ,-1,-1,-1,-1,105420,2,,,,,,e8d9a530bfe7d4aa61316ea6758beb8c,,0,22.349.327.564.239.500,11.805.616.855.621.300,50504,2022-09-25 15:21:42
-1,-1,70,100,75,2:0,0,-1,100,40,80,100,100,-1,-1,80,100,100,-1,100,100,-1,-1,-1,1. G&R best. Artikel2. G&R Präposition fehlt3. Ausdruck Verb,1. Die Eintracht Frankfurts Trainer 2. zum Thema Freitag. 3. spielt Aymen Barkok erneut einsatzbereit. ,-1,-1,-1,-1,105378,1,,,,,,bcfa19d7dbfb721b83cb04c7810044b5,,0,2.995.810.103.416.440,15.539.818.048.477.100,50504,2022-09-25 15:23:43
-1,-1,100,100,100,1:24,0,-1,100,50,100,100,100,-1,-1,100,100,100,-1,100,100,-1,-1,-1,-1,-1,-1,-1,-1,-1,105439,2,,,,,,0a8b78263e5c825a9b23540f5da14c4b,,0,3.649.329.924.583.430,18.769.327.878.952.000,50504,2022-09-25 15:25:09
-1,-1,20,100,75,3:48,0,-1,100,60,70,75,100,-1,-1,20,75,100,-1,100,100,-1,-1,-1,1. G&R2. G&R3. G&R Doppelpunkt und Präp.4. G&R Satzzeichen5. G&R wieder fehlendes Hilfsverb 6. G&R Komma7. Ausdruck und eigentlich Deckungsglechheit&comma; weil man nicht weiß&comma; ob der Zwischenhändler in der Stadt sitzt,1.  es seien keine entsprechenden Masken zum FFP2-Standard verteilt worden. 2. Die Sprecherin von Münchener Sozialreferats 3.  Hedwig Thomalla&comma; sagte &quot;Wir versuchen [...]&quot; gegenüber dem Freitag]   4.  / n 5. 500.000 seien Masken verteilt&comma; 6. nachvollziehbar&quot; berichtet von Heimlich.  7. Über einen Zwischenhändler in der Stadt könnten die Masken angekommen sein,-1,-1,-1,-1,105469,3,,,,,,39f3bd47040d212e4c5915338432ab45,,1,18.760.626.077.651.900,1.534.037.709.236.140,50504,2022-09-25 15:28:59
-1,-1,60,100,100,2:9,0,-1,100,50,80,100,100,-1,-1,80,75,100,-1,100,100,-1,-1,-1,1. G&R2. G&R&comma; Singular&comma; IFC&comma; IA,1. können Zwei Berliner Kliniken 2. Das Gericht folgte nun der Klinik&comma; die meinte&comma; sie müssten dieses Verbot nicht beachten,-1,-1,-1,-1,105421,2,,,,,,d8298c2397085e3373ff055c29c376fc,,0,29.055.572.748.184.200,12.894.524.097.442.600,50504,2022-09-25 15:31:18
-1,-1,30,100,0,3:24,0,-1,75,60,80,100,100,-1,-1,50,75,100,-1,100,100,-1,-1,-1,1. Ausdruck&comma; LKH2. Ausdruck (2x im Text)3. G&R AFZ4. G&R Präp.5. G&R&comma; Ausdruck Satzstellung,1. Bundesfinanzminister Olaf Scholz hat die geplanten neuen Corona-Hilfen etwa für Familien als Teil des Durchhaltens in der Krise bezeichnet. 2.  Aber: &quot; 3.  Sache.&quot;&quot; 4. In erster Lesung beriet der Bundestag mit neuen milliardenschweren Hilfen in der Corona-Krise. 5. Außerdem soll es der großen Koalition ermöglichen&comma; Firmen&comma; die Verluste aus den Corona-Jahren 2020 und 2021 umfangreicher mit vorherigen Gewinnen zu verrechnen.   ,-1,-1,-1,-1,105461,3,,,,,,3d2e80d599baa7e98a1fa0cf1fd1a7c2,,0,20.209.988.832.473.700,16.263.169.050.216.600,50504,2022-09-25 15:34:44
-1,-1,60,100,75,1:41,0,-1,100,50,80,100,100,-1,-1,90,75,100,-1,100,100,-1,-1,-1,1. IFC&comma; IA2. G&R Plural3. Ausdruck,1. Beide Treffer waren einer Ecke vorausgegangen. 2. gelang dem Niedersachsen 3. nur noch vier Zähler weiter,-1,-1,-1,-1,105370,1,,,,,,3e609d89c10976f1bab7eae7e7dde5b3,,0,2.434.605.598.449.700,13.513.559.818.267.800,50504,2022-09-25 15:36:26
-1,-1,50,100,50,17:8,1,-1,75,70,60,100,100,-1,-1,70,50,100,-1,100,100,-1,-1,-1,viele Fehler,Input:Das erste Training für die WM-Abfahrt in Cortina d&#039; Ampezzo hat bei den Skirennfahrern teils heftige Kritik hervorgerufen.  Output: Bei der WM-Abfahrt in Cortina gibt es das erste Training. d&#039; Ampezzo sorgte bei den Skirennfahrern für heftige Kritik,-1,-1,-1,-1,105379,1,,,,,,a1b521d17261a1ce9b71d23bd066c476,,0,5.071.426.439.285.270,22.899.110.555.648.800,70828,2022-09-25 20:24:08
-1,-1,60,100,75,18:57,1,-1,100,70,80,100,100,-1,-1,70,75,100,-1,100,100,-1,-1,-1,1. inhaltliche Fehler2. sprachliche Fehler,Input: Vor zwei Jahren hatte das deutsche Team mit Paul Berg und der aktuell verletzten Hanna Ihedioha WM-Bronze geholt.  Output: Das deutsche Team hatte vor zwei Jahren Paul Berg und die derzeit verletzte Hanna Ihedioha WM-Bronze geholt. ,-1,-1,-1,-1,105450,3,,,,,,81a581dad1c358e2cf388a43d573e940,,0,2.627.591.347.694.390,23.036.064.386.367.700,70828,2022-09-25 20:43:18
-1,-1,70,100,100,13:42,1,-1,100,70,80,100,100,-1,-1,100,75,100,-1,100,100,-1,keine Grammatik Fehler,-1,impliziter Fact Check Fehler,Input: Weitere Soldaten&comma; die nach der Prioritätenliste noch nicht an der Reihe gewesen wären&comma; erhielten demnach übrig gebliebene Dosen in den Impfzentren&comma; in denen die Truppe derzeit aushilft. Output: In den Impfzentren&comma; in denen die Truppe derzeit aushilft&comma; erhielten dem Bericht zufolge weitere Soldaten übrig gebliebene Dosen&comma; weil sie nach der Prioritätenliste nicht an der Reihe waren. ,-1,-1,-1,-1,105397,2,,,,,,62dd4277bd1edebe5415d68b2dced05b,,0,20.092.352.867.126.400,7.202.167.272.567.740,70828,2022-09-25 20:57:01
-1,-1,60,100,100,7:7,1,-1,100,50,80,100,100,-1,-1,100,75,100,-1,100,100,-1,Inhalt größtenteils gut übernommen,-1,1. IFC erster Satz: von etwas erholen =/= auf etwas einstellen2. Wenig Unterschied,-1,-1,-1,-1,-1,105353,1,,,,,,2e76a7f6d6f8925907f2002d5bd1be55,,0,17.507.827.758.789.000,5.809.609.651.565.550,53332,2022-09-26 09:09:00
-1,-1,70,100,75,13:36,1,-1,100,50,100,100,100,-1,-1,100,100,100,-1,100,100,-1,Inhalt gut übernommen,-1,1. Wenig Unterschied.2. Teils nicht so runder Ausdruck,&quot; [...] keine Zuschauer erlaubt. Bislang waren Besucher erlaubt.&quot;,-1,-1,-1,-1,105412,2,,,,,,fd44a6be42223b4dada11d14b10d2f49,,0,30.564.244.985.580.400,15.554.382.085.800.100,53332,2022-09-26 09:22:39
