comment,blacklist_suggestions,overall_quality,factual_correctness,readability,rating_time,warm_up,user_suggestions,action_coherence,linguistic_difference,content_similarity,identical_information,exhaustive_information,story_edit,story_old,grammar,implicit_fact_check,citation_correct,context_realization,false_gender,false_mood,matches_fandom,positive_comment,positive_example,negative_comment,negative_example,implicit_fc_comment,implicit_fc_example,positive_comment_topic,negative_comment_topic,story_id,listvalue,story_group,length,topk,temperature,likelihood_score,hash,version,amount_fallbacks,duration_generation,dur_score,user,date
-1,-1,-1,-1,-1,1:1,0,-1,-1,-1,-1,-1,-1,-1,-1,70,1,-1,-1,-1,-1,-1,-1,-1,1. Satzstellung und fehlender Doppelpunkt2. Falscher Doppelpunkt,1. Der Leverkusener Fußball Trainer (57) sagte &quot;Ich glaube&comma; er kommt wegen mehrerer Spieler. Aber ich könnte es verstehen&comma; wenn er auch wegen Florian Wirtz kommt&quot; am Freitag. 2. t&quot;: D,-1,-1,-1,-1,105473,3,,,,,,76f975836ba47b1ecd96dca09bc8d750,,1,23.146.522.521.972.600,1.896.180.534.362.790,50504,2022-09-18 19:39:28
-1,-1,70,100,75,8:46,1,-1,100,40,100,100,100,-1,-1,100,100,100,-1,100,100,-1,Inhalt gut übernommen,-1,Recht wenig Unterschied,-1,-1,-1,-1,-1,105355,1,,,,,,c02cf7be411540ea908fae1e6ca115fb,,0,24.323.166.847.229.000,9.740.926.742.553.710,53332,2022-09-19 09:12:39
-1,-1,60,100,50,9:21,1,-1,100,50,100,100,100,-1,-1,90,100,100,-1,100,100,-1,Inhalt größtenteils gut übernommen,-1,Wenig Unterschied&comma; teils holprig formuliert,&quot;Das deutsche Team hatte vor zwei Jahren Paul Berg und die derzeit verletzte Hanna Ihedioha WM-Bronze geholt. &quot;,-1,-1,-1,-1,105450,3,,,,,,81a581dad1c358e2cf388a43d573e940,,0,2.627.591.347.694.390,23.036.064.386.367.700,53332,2022-09-19 09:22:02
-1,-1,50,-1,75,14:45,1,-1,100,50,80,100,100,-1,-1,80,100,100,-1,100,100,-1,Inhalt größtenteils gut übernommen,-1,Wenig Unterschied&comma; Formulierungen nicht immer rund,-1,-1,-1,-1,-1,105428,2,,,,,,86f3ae2fc11c7c9298c71f710234a9b6,,0,3.561.664.366.722.100,2.143.607.187.271.110,53332,2022-09-19 09:36:48
-1,-1,70,100,75,12:5,1,-1,100,60,90,100,100,-1,-1,100,75,100,-1,100,100,-1,Inhalt größtenteils gut übernommen,-1,IFC: Output vertauscht&comma; wessen Ergebnis von wem abhängt,-1,-1,-1,-1,-1,105443,3,,,,,,e3dbb3e359fe24a92918be7f37a6798f,,0,17.617.835.521.697.900,1.422.437.047.958.370,53332,2022-09-19 09:48:55
-1,-1,60,100,75,13:44,0,-1,100,50,100,100,100,-1,-1,90,100,100,-1,100,100,-1,Inhalt gut übernommen,-1,Wenig Unterschied,-1,-1,-1,-1,-1,105395,2,,,,,,a8b7b08485cc9c5156cdb7e19572c98c,,0,4.067.412.853.240.960,22.639.745.473.861.600,53332,2022-09-19 10:02:40
-1,-1,60,100,75,22:46,0,-1,100,50,90,100,75,-1,-1,100,100,100,-1,100,100,-1,Inhalt größtenteils gut übernommen,-1,Recht wenig Unterschied,-1,-1,-1,-1,-1,105346,1,,,,,,62093fb06e52b701a8cf393abcb9f1c8,,0,2.016.749.334.335.320,10.481.488.466.262.800,53332,2022-09-19 10:25:30
-1,-1,70,100,100,10:18,0,-1,100,60,90,100,100,-1,-1,90,75,100,-1,100,100,-1,Inhalt größtenteils gut übernommen,-1,IFC: Das Gericht folgte den Kliniken&comma; nicht umgekehrt,-1,-1,-1,-1,-1,105371,1,,,,,,b755b7ade70b1182b74fcc35d797f1d7,,0,29.533.112.287.521.300,12.220.218.181.610.100,53332,2022-09-19 10:35:49
-1,-1,70,100,100,4:55,0,-1,100,50,100,100,100,-1,-1,90,100,100,-1,100,100,-1,Inhalt gut übernommen,-1,Wenig Unterschied,-1,-1,-1,-1,-1,105453,3,,,,,,488ecc138a1e6f357ee2f53266e65e84,,0,9.792.295.932.769.770,7.625.837.802.886.960,53332,2022-09-19 10:40:45
-1,-1,60,100,25,15:46,1,-1,75,80,70,100,100,-1,-1,80,75,100,-1,100,100,-1,-1,-1,1. Grammatik2. Impliziter FehlerHäufiger wurde aus einem spezifischeren &quot;dem&quot; o.ä ein wahrloser wirkendes &quot;einem&quot; oder andersrum,1. &quot;Ihr Kind hatte sich währenddessen zusammen mit einem anderen&comma; vierjährigen Kind dem ordnungsgemäß abgestellten Hänger auf zwei Pferden genähert. &quot;  2. &quot;An den Folgekosten wollten sich die Pferdebesitzerin und die Haftpflichtversicherung vom Landgericht Freiburg und dem Oberlandesgericht Karlsruhe beteiligen. &quot; ,-1,-1,-1,-1,105402,2,,,,,,d93f760a55d0df9cd381f23b54f8c16d,,0,5.424.996.638.298.030,26.454.185.247.421.200,89491,2022-09-19 12:23:55
-1,-1,70,100,100,9:53,1,-1,100,50,100,100,100,-1,-1,90,100,100,-1,100,100,-1,Inhalt gut übernommen,-1,Wenig Unterschied,-1,-1,-1,-1,-1,105411,2,,,,,,cb95570ad1cfe82d6584efa70121c68c,,0,3.237.255.382.537.840,1.415.893.030.166.620,53332,2022-09-19 12:43:22
-1,-1,80,100,75,2:12,1,-1,100,80,90,100,100,-1,-1,100,100,-1,-1,100,100,-1,-1,-1,Ausdruck ab und zu ein wenig unnatürlich,-1,-1,-1,-1,-1,105462,3,,,,,,4e079333921d4da410dcb9e4b58e9eb8,,0,19.527.485.132.217.400,16.201.507.329.940.700,89491,2022-09-19 12:44:40
-1,-1,90,100,75,2:33,1,-1,100,100,100,100,100,-1,-1,100,100,100,-1,100,100,-1,Sehr schön,-1,-1,-1,-1,-1,-1,-1,105427,2,,,,,,89e4a0321568c594238a1252564dfde3,,0,24.356.505.632.400.500,1.147.329.592.704.770,89491,2022-09-19 12:47:18
-1,-1,60,100,75,10:7,1,-1,100,50,90,100,100,-1,-1,90,100,100,-1,100,100,-1,Inhalt größtenteils gut übernommen,-1,Wenig Unterschied&comma; holprig formuliert,Bspw. &quot;sondern&quot; im letzten Outputsatz,-1,-1,-1,-1,105433,2,,,,,,dbf230d8d7e507edfa85cbcba730b0e6,,0,3.469.327.926.635.740,15.689.248.085.021.900,53332,2022-09-19 12:53:30
-1,-1,70,100,75,10:21,1,-1,100,60,100,100,100,-1,-1,100,100,100,-1,100,100,-1,Inhalt gut übernommen,-1,Könnte mehr Unterschied haben,-1,-1,-1,-1,-1,105442,3,,,,,,3710514ff75c549c67c6fb9793cb6fe8,,0,2.065.377.378.463.740,17.409.584.522.247.300,53332,2022-09-19 13:03:53
-1,-1,60,100,75,10:22,1,-1,100,60,100,100,100,-1,-1,80,100,100,-1,100,100,-1,Inhalt größtenteils gut übernommen,-1,Kleinere Fehler,&quot;Alle Zuschauer mussten in der Rod-Laver-Arena [...] verlassen.&quot;,-1,-1,-1,-1,105362,1,,,,,,6e484e3653cbe957f94bd341a337e2d7,,0,2.878.026.247.024.530,135.924.813.747.406,53332,2022-09-19 13:14:15
-1,-1,60,100,75,6:23,0,-1,100,40,100,100,100,-1,-1,90,100,100,-1,100,100,-1,Inhalt gut übernommen,-1,Wenig Unterschied,-1,-1,-1,-1,-1,105401,2,,,,,,e3e125aa094d302076bbd00275b2a859,,0,2.314.847.731.590.270,14.796.672.582.626.300,53332,2022-09-19 13:20:52
-1,-1,60,100,75,13:26,0,-1,100,50,90,100,100,-1,-1,100,100,100,-1,100,100,-1,Inhalt größtenteils gut übernommen,-1,Teils nicht ganz passend paraphrasiert,Empfänger =/= Betroffene,-1,-1,-1,-1,105361,1,,,,,,203c11cd2f05321b3686fc4db12134af,,0,33.794.536.113.739.000,15.540.894.508.361.800,53332,2022-09-19 13:34:19
-1,-1,70,100,100,14:5,0,-1,100,50,100,100,100,-1,-1,90,100,100,-1,100,100,-1,Inhalt gut übernommen,-1,Recht wenig Unterschied,-1,-1,-1,-1,-1,105477,3,,,,,,fd116f160d9b19a41f75e3fa52e8ec63,,0,19.457.018.613.815.300,1.616.882.586.479.180,53332,2022-09-19 13:48:29
-1,-1,60,100,75,11:57,0,-1,100,60,90,100,100,-1,-1,70,100,100,-1,100,100,-1,Inhalt größtenteils gut übernommen,-1,Abzüge in Ausdruck und Grammatik,Bspw.: letzter Satz im ersten Absatz des Outputs,-1,-1,-1,-1,105382,1,,,,,,a078bfb411c6a7a352cc2118778dbd1a,,0,3.699.527.287.483.210,17.742.119.789.123.500,53332,2022-09-19 14:00:27
-1,-1,50,100,75,7:33,1,-1,100,90,70,100,100,-1,-1,70,50,100,-1,-1,100,-1,-1,-1,1. Kausalzusammenhang,1. &quot;Ein Bayreuther Friseur will diesen jetzt für einen guten Zweck versteigern&comma; weil der Andrang auf einen ersten Termin nach dem Lockdown enorm ist.&quot; / &quot;Er habe mehr als 150 Anrufe erhalten und seit klar sei&comma; dass er am 1. März wieder öffnen dürfe&comma; teilte Friseur Andreas Nuissl (57) am Freitag auf Anfrage mit&quot; ,-1,-1,-1,-1,105349,1,,,,,,3c411689f44b2719f79623d98dfe1a42,,0,3.205.979.657.173.150,15.659.706.354.141.200,89491,2022-09-19 15:19:38
-1,-1,70,100,75,4:18,1,-1,100,80,60,100,100,-1,-1,80,100,100,-1,100,100,-1,-1,-1,1. Grammatik,1. &quot;In den Impfzentren&comma; in denen die Truppe derzeit aushilft&comma; erhielten dem Bericht zufolge weitere Soldaten übrig gebliebene Dosen&comma; weil sie nach der Prioritätenliste nicht an der Reihe waren.&quot; / &quot;Der Bericht basiert auf Informationen im Sanitätswesen der Bundeswehr. Nach &quot;Spiegel&quot; -Informationen hatte die Bundeswehr. &quot;,-1,-1,-1,-1,105397,2,,,,,,62dd4277bd1edebe5415d68b2dced05b,,0,20.092.352.867.126.400,7.202.167.272.567.740,89491,2022-09-19 15:23:57
-1,-1,90,100,75,5:1,1,-1,100,90,90,100,100,-1,-1,100,100,100,-1,100,100,-1,Sehr hübsch. ,-1,1.Ausdruck verändert Aussage,1. &quot;Die Impfstoffe hätten dann vernichtet werden müssen.&quot; ,-1,-1,-1,-1,105347,1,,,,,,47806a8dbafdfd4f759c21299b5bbac0,,0,2.015.132.188.796.990,6.686.355.113.983.150,89491,2022-09-19 15:28:59
-1,-1,20,100,50,39:17,1,-1,100,30,80,75,100,-1,-1,70,100,100,-1,100,100,-1,-1,-1,1. Deckungsgleichheit2. Grammatik: Doppelte Anführunsgzeichen&comma; dieser Fehler kommt in vielen Texten vor ,1. &quot;Ich glaube&comma; für heute war es gut&comma; dass sie es so eingebremst haben. Es bringt keinem was&comma; wenn die Startnummer 1 beim Vertigine-Sprung bis ins Loch springt und beide Knie kaputt gehen&quot;&comma; sagt der Coach,-1,-1,-1,-1,105429,2,,,,,,6d1c208863af6ae3cdbb8aeb36947e35,,0,5.240.415.096.282.950,2.525.072.193.145.750,79689,2022-09-19 15:31:37
-1,-1,50,100,75,9:59,1,-1,75,90,70,100,100,-1,-1,90,100,90,-1,100,100,-1,-1,-1,1. Kohärenz2. AusdruckEin &quot;n/&quot; ist aufgetaucht,1. &quot;Am Freitag stimmte Zwei Wochen nach dem Bundestag auch dem Bundesrat ein entsprechendes Gesetz zu.&quot; 2. &quot;In Deutschland könnten neue Stromtrassen schneller gebaut werden.&quot; ,-1,-1,-1,-1,105486,3,,,,,,5192b1f6ea3b0d4f81c30baebf55cab5,,0,4.580.627.465.248.100,4.177.520.775.794.980,89491,2022-09-19 15:39:05
-1,-1,90,100,100,3:20,0,-1,100,90,100,100,100,-1,-1,90,100,-1,-1,100,100,-1,Sehr hübsch umformuliert. ,-1,Ein Komma anstatt eines Punktes ,-1,-1,-1,-1,-1,105358,1,,,,,,0bc6c3af0536ebc0a3a30abb8d1d4cb6,,0,19.197.736.501.693.700,9.056.057.453.155.510,89491,2022-09-19 15:42:32
-1,-1,10,100,50,19:33,1,-1,75,10,30,100,100,-1,-1,50,50,100,-1,100,100,-1,-1,-1,1. Ausdruck 2. Grammatik: Falsche Präposition für Wochentag&comma; Fehler tritt in mehreren Texten wiederholt auf3. Impliziter Fact-Check,1. Das gab Snowboard Germany wenige Stunden vor dem Start bekannt. -> Es kam von Snowboard Germany Wenige Stunden vor der Teilnahme bekannt. 2. Bei einem Sturz hatte sich die Sportlerin von SC Löffingen in Baden-Württemberg im Donnerstag verletzt. 3. Das deutsche Team hatte vor zwei Jahren Paul Berg und die derzeit verletzte Hanna Ihedioha WM-Bronze geholt. Am Donnerstag waren Nörl (Adlkofen)&comma; Berg (Konstanz) Fünfte und Sechste geworden,-1,-1,-1,-1,105450,3,,,,,,81a581dad1c358e2cf388a43d573e940,,0,2.627.591.347.694.390,23.036.064.386.367.700,79689,2022-09-19 15:51:11
-1,-1,40,100,50,9:4,0,-1,50,100,80,100,100,-1,-1,80,100,100,-1,100,100,-1,-1,-1,1. Grammatik2. Änderung der Aussage3. Kohärenz ,1. &quot;(...) im Stadt verbracht (...)&quot;  / &quot;Unter den Preisträgern: den Philosophen Theodor W. Adorno (...)&quot; 2. &quot;Zimmer werde &quot;eine Hollywood-Ikone und dabei Kulturbotschafter unseres Landes und unserer Stadt&quot;.&quot; 3.&quot; Die Musik stammt von ihm zu Dutzenden Filmen&comma; darunter &quot;Rain Man&quot; und &quot;Fluch der Karibik&quot;.&quot; /&quot; Sobald es die Corona-Pandemie zulasse&comma; werde Zimmer die Plakette erhalten und einen Termin gefunden. Eine Sprecherin des Kulturdezernats erklärte&comma; in welcher Form dann entschieden werde.&quot;,-1,-1,-1,-1,105460,3,,,,,,95f3329458fa20d98dfafbd15b2d4851,,0,1.830.296.564.102.170,15.143.486.976.623.500,89491,2022-09-19 15:51:41
-1,-1,90,100,100,8:10,1,-1,100,90,100,100,100,-1,-1,90,100,100,-1,100,100,-1,-1,-1,-1,-1,-1,-1,-1,-1,105369,1,,,,,,dd4654974a86a92aec341b8b8a6ddab5,,0,2.420.033.836.364.740,10.526.456.832.885.700,79689,2022-09-19 15:59:22
-1,-1,70,100,75,11:40,1,-1,75,70,90,100,100,-1,-1,80,75,100,-1,100,100,-1,viele Umstellungen,-1,Fact Check Fehler,Input: Mit einem Oldtimertraktor aus DDR-Zeiten hat ein Betrunkener in Diedrichshagen (Mecklenburg-Vorpommern) Schnee geschoben – und ist nun seinen Führerschein los. Output: Ein Betrunkener hat in Diedrichshagen (Mecklenburg-Vorpommern) mit einem Oldtimer-Traktor aus DDR-Zeiten Schnee geschoben – und ist nun mit seinem Führerschein losgegangen,-1,-1,-1,-1,105367,1,,,,,,1845f21a86092647d97c74a40461f447,,1,27.927.711.248.397.800,14.297.719.240.188.500,70828,2022-09-20 09:13:49
-1,-1,70,100,75,20:9,1,-1,100,60,90,100,100,-1,-1,90,100,100,-1,-1,100,-1,Inhalt gut übernommen,-1,Teils unpassender Ausdruck,&quot;Und der BGH sieht anders aus: &quot;,-1,-1,-1,-1,105452,3,,,,,,fc9d302cda9d498a93ce784d3ff1338d,,0,40.338.274.002.075.100,33.887.983.322.143.500,53332,2022-09-20 09:20:09
-1,-1,20,100,25,15:13,1,-1,50,70,50,100,50,-1,-1,30,50,100,-1,-1,100,-1,-1,-1,1. inhaltliche Fehler2. sprachliche Fehler,1. Input:...sagte Trainer Pal Dardai.  Output:...sagt Geschäftsführer Pal Dardai. 2. EINE LEWANDOWSKI GEGEN&comma; EINE; GANZE HERTHA: ,-1,-1,-1,-1,105434,2,,,,,,3393ff102fb3abd8396b2e33244c6acc,,0,9.077.144.408.226.010,5.197.362.732.887.260,70828,2022-09-20 09:29:03
-1,-1,50,100,50,10:47,1,-1,100,80,60,100,100,-1,-1,90,25,100,-1,100,100,-1,-1,-1,1. Impliziter Fact-Check (& Ausdruck): vermehrte faktische Ungenauigkeiten&comma; teils durch unpassende Ausdrücke verursacht ,1.Im Ringen um die Streichung von TV-Kosten aus der Nebenkostenabrechnung von Mietern bekommt die Bundesregierung Gegenwind aus den Ländern. -> Die Bundesregierung bekommt im Kampf gegen die Streichung von TV-Kosten aus der Nebenkostenabrechnung der Mieter Gegenwind aus den Ländern,-1,-1,-1,-1,105444,3,,,,,,cda5e07846f9b7a4d0df5200bd37a3f1,,0,3.560.109.090.805.050,30.185.426.950.454.700,79689,2022-09-20 09:30:09
-1,-1,60,100,50,12:38,1,-1,100,50,100,100,100,-1,-1,90,100,100,-1,100,100,-1,Inhalt gut übernommen,-1,1. Wenig Unterschied2. Ausdrucksfehler,2. &quot;jetzt ist sein Führerschein los&quot;,-1,-1,-1,-1,105417,2,,,,,,68494c0e157fa72ed23673d43c080da1,,0,30.197.975.635.528.500,16.864.835.023.880.000,53332,2022-09-20 09:32:51
-1,-1,30,100,25,9:10,1,-1,75,60,50,100,100,-1,-1,100,50,100,-1,-1,100,-1,-1,-1,1. Viele unschöne Ausdrücke,1. Das höchste Gebot lag am frühen Freitagnachmittag mit 282 Euro,-1,-1,-1,-1,105349,1,,,,,,3c411689f44b2719f79623d98dfe1a42,,0,3.205.979.657.173.150,15.659.706.354.141.200,79689,2022-09-20 09:39:20
-1,-1,90,100,100,4:5,1,-1,100,80,100,100,100,-1,-1,100,100,100,-1,100,100,-1,-1,-1,-1,-1,-1,-1,-1,-1,105427,2,,,,,,89e4a0321568c594238a1252564dfde3,,0,24.356.505.632.400.500,1.147.329.592.704.770,79689,2022-09-20 09:43:27
-1,-1,20,100,50,6:26,1,-1,75,40,50,100,100,-1,-1,70,50,100,-1,100,100,-1,-1,-1,1. Lokale Kohärenz & Impliziter Fact-Check,1.  Eintracht s. Die Gegner von Frankfurts Trainer Adi Hütter sind wegen der aktuellen Erfolgsserie besonders motiviert. / Bei der TSG 1899 gab es nach dem kurzfristigen Ausfall im Gastspiel einen Hoffenheim: Aymen Barkok fortan wieder einsatzbereit,-1,-1,-1,-1,105478,3,,,,,,938bfce7972d7f0cb3dc3d1459f259b3,,0,28.751.121.997.833.200,2.508.334.708.213.800,79689,2022-09-20 09:50:01
-1,-1,80,100,75,21:9,1,-1,100,60,100,100,100,-1,-1,90,100,100,-1,100,100,-1,Inhalt gut übernommen,-1,Wenig Unterschied,-1,-1,-1,-1,-1,105390,2,,,,,,55a43943a92d18504679e6c761cf5861,,0,799.462.661.743.164,52.971.123.695.373.500,53332,2022-09-20 09:54:01
-1,-1,60,100,50,16:1,1,-1,100,50,90,100,100,-1,-1,80,100,100,-1,100,100,-1,Inhalt gut übernommen,-1,Holpriger Ausdruck,&quot;Ein Bayreuther Friseur will diesen jetzt für einen guten Zweck versteigern&comma; weil der Andrang auf einen ersten Termin nach dem Lockdown enorm ist&quot;,-1,-1,-1,-1,105349,1,,,,,,3c411689f44b2719f79623d98dfe1a42,,0,3.205.979.657.173.150,15.659.706.354.141.200,53332,2022-09-20 10:10:03
-1,-1,60,100,75,9:2,0,-1,100,60,90,100,100,-1,-1,70,100,100,-1,100,100,-1,Inhalt gut übernommen,-1,Wenig Unterschied,-1,-1,-1,-1,-1,105486,3,,,,,,5192b1f6ea3b0d4f81c30baebf55cab5,,0,4.580.627.465.248.100,4.177.520.775.794.980,53332,2022-09-20 10:19:11
-1,-1,70,100,75,13:56,0,-1,100,60,100,100,100,-1,-1,90,100,100,-1,100,100,-1,Inhalt gut übernommen,-1,Teils unpassender Ausdruck,&quot;beim Freitag&quot;,-1,-1,-1,-1,105375,1,,,,,,2491f2ebbe2f0866add57122b75ad0b1,,0,4.321.849.179.267.880,18.696.088.552.474.900,53332,2022-09-20 10:33:11
-1,-1,70,100,75,15:11,0,-1,100,50,100,100,100,-1,-1,100,100,100,-1,100,100,-1,Inhalt gut übernommen,-1,Wenig Unterschied,-1,-1,-1,-1,-1,105397,2,,,,,,62dd4277bd1edebe5415d68b2dced05b,,0,20.092.352.867.126.400,7.202.167.272.567.740,53332,2022-09-20 11:44:42
-1,-1,60,100,50,6:52,0,-1,100,50,80,100,100,-1,-1,80,100,100,-1,100,100,-1,Inhalt übernommen,-1,Holpriger Ausdruck,&quot;gegenüber dem Freitag&quot;,-1,-1,-1,-1,105469,3,,,,,,39f3bd47040d212e4c5915338432ab45,,1,18.760.626.077.651.900,1.534.037.709.236.140,53332,2022-09-20 11:51:36
-1,-1,60,100,75,8:27,0,-1,100,50,90,100,100,-1,-1,90,100,100,-1,100,100,-1,Inhalt übernommen,-1,1. Wenig Unterschied2. Holpriger Ausdruck,2. &quot;[...] nahm er an 13 Toren [...] teil.&quot;,-1,-1,-1,-1,105473,3,,,,,,76f975836ba47b1ecd96dca09bc8d750,,1,23.146.522.521.972.600,1.896.180.534.362.790,53332,2022-09-20 12:00:04
-1,-1,60,100,75,12:27,0,-1,100,50,90,100,100,-1,-1,100,75,100,-1,100,100,-1,Inhalt größtenteils gut übernommen,-1,Output vertauscht was von was abhängt,&quot;Wie die Geschäfte der Volkswagen AG laufen&comma; hängt im Wesentlichen vom Ergebnis der durch die Familien Porsche und Piëch kontrollierten Porsche SE (PSE) ab&quot;,-1,-1,-1,-1,105393,2,,,,,,acd2a44b7089d38069dcb7565f5045e3,,0,23.619.109.630.584.700,875.697.946.548.462,53332,2022-09-20 12:12:32
-1,-1,-1,-1,75,11:1,0,-1,-1,-1,-1,-1,-1,-1,-1,-1,75,-1,-1,-1,-1,-1,-1,-1,1. Abzüge in Ausdruck.2. Output vertauscht wer von wem abhängt,1. z.B.: &quot;Die Stuttgarter Holding teilte am Freitag mit&comma; mit 2&comma;6 Milliarden Euro nach Steuern sei nach jetzigem Stand zu rechnen&quot;,-1,-1,-1,-1,105343,1,,,,,,96667c95a9f351313f869716571bec48,,0,2.583.570.909.500.120,10.271.106.958.389.200,53332,2022-09-20 12:23:34
-1,-1,70,100,75,20:24,0,-1,100,50,90,100,100,-1,-1,100,100,100,-1,100,100,-1,1. Inhalt übernommen,-1,2. Wenig Unterschied,-1,-1,-1,-1,-1,105385,1,,,,,,af0dc6a17264c50df8def44b61f23160,,0,26.398.294.925.689.600,14.323.066.711.425.700,53332,2022-09-20 12:43:59
-1,-1,60,100,75,7:59,0,-1,100,50,80,100,75,-1,-1,90,100,100,-1,100,100,-1,Inhalt größtenteils gut übernommen,-1,Ausdruck nicht immer passend,&quot;Außenminister Peter Szijjarto stellt das Vorliegen der Bedingungen klar.&quot;,-1,-1,-1,-1,105441,3,,,,,,a0610dda65be20d68b56e8e8dc66ed6b,,0,3.457.465.648.651.120,29.719.374.179.840.000,53332,2022-09-20 12:52:02
-1,-1,60,100,50,19:36,0,-1,100,60,90,100,100,-1,-1,50,100,100,-1,100,100,-1,Inhalt größtenteils gut übernommen,-1,Einige Abzüge in Grammatik und Ausdruck,&quot;Ein weiterer 65 [...]&quot; ,-1,-1,-1,-1,105432,2,,,,,,e305dfa0114bc2d4f55ea07b48978b25,,0,3.913.828.682.899.470,20.238.479.375.839.200,53332,2022-09-20 13:11:45
-1,-1,40,100,75,6:38,1,-1,100,60,100,100,100,-1,-1,100,100,90,-1,100,100,-1,-1,-1,Recht viel Ähnlichkeit&comma; ein doppeltes Anführungszeichen,-1,-1,-1,-1,-1,105406,2,,,,,,9951ff0763f6197c3590cd7981226450,,0,29.394.317.150.115.900,13.400.354.146.957.300,89491,2022-09-20 13:18:12
-1,-1,60,100,50,3:7,1,-1,100,90,100,100,100,-1,-1,100,100,-1,-1,100,100,-1,-1,-1,1. Satz klingt nicht so rund2. Doppeltes &quot;und&quot;&comma; klingt nicht so schön,1. &quot;Man habe im vergangenen Jahr im SUV-Werk Spartanburg 361.000 Autos gebaut&comma; 219.000 Autos im Wert von 8&comma;9 Milliarden Dollar exportiert&comma; teilte BMW am Freitag in München mit. &quot; 2. &quot;(...) sind China (23 Prozent)&comma; Deutschland (13 Prozent) und Südkorea&comma; Kanada und Russland.&quot;,-1,-1,-1,-1,105451,3,,,,,,60245a00a85e9a5275cb41816db97219,,0,19.645.898.580.551.100,17.512.157.917.022.700,89491,2022-09-20 13:21:24
-1,-1,80,100,100,2:17,1,-1,75,90,100,100,100,-1,-1,80,100,-1,-1,100,100,-1,-1,-1,1. Fehlerhafte Punktation am Ende und fehlende Klammern nach &quot;Deutschland&quot;,1. &quot;Die wichtigsten Exportländer des SUV-Werks Spartanburg sind China (23 Prozent)&comma; Deutschland&comma; 13 Prozent&comma; Südkorea&comma; Kanada und Russland;&quot; ,-1,-1,-1,-1,105401,2,,,,,,e3e125aa094d302076bbd00275b2a859,,0,2.314.847.731.590.270,14.796.672.582.626.300,89491,2022-09-20 13:23:42
-1,-1,50,100,75,6:6,1,-1,100,70,70,100,75,-1,-1,90,100,100,-1,100,100,-1,-1,-1,1. Ausdruck nicht so schön2. Information fehlt3. Aus Singular wurde Plural,1. &quot;Die insgesamt 5000 Quadratmeter große Fabrikhalle brannte in der Nacht voll mit Behältern aus Säuren und Laugen. &quot;  2. &quot;Im Einsatz waren bis zu 170 Feuerwehrleute. &quot; 3. &quot;Die Mitarbeiter einer Energieversorgungsfirma wurden leicht verletzt. &quot; ,-1,-1,-1,-1,105342,1,,,,,,26e309f43066d2f05423bdc787e74f13,,0,2.939.648.199.081.420,14.603.731.870.651.200,89491,2022-09-20 13:29:59
-1,-1,80,100,75,2:52,0,-1,100,90,90,100,100,-1,-1,100,100,100,-1,100,100,-1,-1,-1,1. Ausdruck fehlleitend,1. &quot;(...)Straßenschild und eine Straßenlaterne in Lübeck Teil des geplanten Denkmals werden. &quot; ,-1,-1,-1,-1,105396,2,,,,,,2b9e6edb98a877da170cd14cabb71f45,,0,17.279.476.642.608.600,7.831.125.974.655.150,89491,2022-09-20 13:32:58
-1,-1,10,100,75,8:46,1,-1,50,100,30,75,50,-1,-1,90,75,100,-1,100,100,-1,-1,-1,Aus &quot;Donnerstagabend&quot; wurde &quot;in der Nacht zum Donnerstag&quot;.1. Kohärenz&comma; Informationen fehlen2. Kohärenz&comma; Kausalzusammenhang nicht mehr klar3. Ausdruck unnatürlich4. Grammatik und Kohärenz5. Kohärenz,1. &quot;Die drei Opfer seien kritisch. &quot; 2. &quot;Die Karambolage sei durch Eis und überfrierenden Regen ausgelöst worden&comma; werde aber angenommen.&quot; 3. &quot;Im morgendlichen Berufsverkehr ereignete sich die Massenkarambolage. &quot; 4. &quot;Den Einsatz von Rettern habe die eisglatte Straße behindert.&quot; 5. &quot;Bei Dallas seien 18 Autos ineinander gefahren und nahe Austin eine weitere Massenkarambolage mit insgesamt 26 Fahrzeugen gegeben worden.&quot;,-1,-1,-1,-1,105382,1,,,,,,a078bfb411c6a7a352cc2118778dbd1a,,0,3.699.527.287.483.210,17.742.119.789.123.500,89491,2022-09-20 16:27:29
-1,-1,50,100,50,15:19,1,-1,100,70,80,100,100,-1,-1,80,50,100,-1,-1,100,-1,viele Umstellungen,-1,inhaltliche Fehler,Input: Nach Bekanntwerden der Versteigerung hatte eine Kundin die Spendenaktion erweitert:  Output: Eine Kundin hatte nach Bekanntwerden der Versteigerung ihre Spendenaktion verlängert: ,-1,-1,-1,-1,105349,1,,,,,,3c411689f44b2719f79623d98dfe1a42,,0,3.205.979.657.173.150,15.659.706.354.141.200,70828,2022-09-20 21:50:27
-1,-1,70,100,75,20:9,1,-1,100,70,100,100,100,-1,-1,90,100,100,-1,100,100,-1,keine inhaltlichen Fehler,-1,Ausdruck Fehler,Nach Einschätzung von Triskas ist selbst eine tägliche Testpflicht eine enorme zusätzliche Belastung. ,-1,-1,-1,-1,105439,2,,,,,,0a8b78263e5c825a9b23540f5da14c4b,,0,3.649.329.924.583.430,18.769.327.878.952.000,70828,2022-09-20 22:10:38
-1,-1,60,100,50,13:41,1,-1,75,80,100,100,100,-1,-1,100,100,100,-1,100,100,-1,1. Sehr schön umformuliert&comma; Sachzusammenhang elegant beibehalten,1. &quot;Im RedaktionsNetzwerk Deutschland (RND)&comma; der die Zeitungen der Mediengruppe und andere Zeitungskunden mit überregionalen Inhalten beliefert&comma; hatte der 40-Jährige zuletzt den Digital Hub geleitet.&quot;,1. Aufzählung von zwei Sachen mit Komma getrennt&comma; klingt nicht so flüssig2. Ausdruck nicht so schön,1. &quot;Wie die Mediengruppe am Freitag in Hannover mitteilte&comma; wird Frerk Schenker zum 1. März Chefredakteur des &quot;Göttinger Tageblatts&quot; (GT)&comma; des &quot;Eichsfelder Tageblatts &quot;(ET). &quot; 2. &quot;Für die Madsack Mediengruppe ist der 53-Jährige fast 20 Jahre in verschiedenen Positionen tätig gewesen. &quot;,-1,-1,-1,-1,105481,3,,,,,,fe425aead24f7659d9d0a95c6009605b,,0,18.863.687.753.677.300,16.072.402.238.845.800,89491,2022-09-21 12:17:31
-1,-1,40,100,75,21:8,1,-1,50,70,60,100,100,-1,-1,70,75,100,-1,100,100,-1,-1,-1,1. Grammatik und Kohärenz. Satz wurde unpassend in zwei Teile gespalten2. Satz nicht beendet&comma; Grammatik3. Bezugswort unpassend4. Kausalzusammenhang und Kohärenz,1. &quot;Der frühere Direktor von Internationalen Währungsfonds (IWF)&comma; der wegen Unterschlagung von Bankgeldern verurteilt wurde. Rodrigo Rato ist nach Medienberichten in Spanien nach über zwei Jahren hinter Gittern vorzeitig auf freiem Fuß. &quot;  2. &quot;Rato war Ende Oktober 2018 in das Gefängnis von Soto del Real&comma; 40 Kilometer nördlich von Madrid&comma; eingewiesen. &quot; 3. &quot;2012 wurde es teilverstaatlicht. &quot; 4. &quot;Spanien beantragte ein europäisches Rettungspaket über 41 Milliarden Euro&comma; wie der Beinahe-Zusammenbruch erklärte. &quot;,-1,-1,-1,-1,105440,3,,,,,,b90102599863bf1f4ad8099e0d48d184,,0,7.145.075.416.564.940,6.573.817.205.429.070,89491,2022-09-21 13:15:43
-1,-1,40,75,0,27:15,1,-1,75,80,50,100,75,-1,-1,90,75,70,-1,100,100,-1,-1,-1,1. Ausdruck2. Ausdruck und impliziter Fehler3. Wort verändert4. Ein Ausrufezeichen hat sich randomisiert eingeschlichen5. Kohärenz&comma; agierende Person nicht klar6. Ausdruck,1. &quot;Videokonferenzen sind ein gutes Erfindungsbild. &quot;  2. &quot;Dumm nur&comma; wenn man die Technologie nicht so möchte wie man selbst. &quot; 3. &quot;KATZENPACKER: (...)&quot; 4. &quot;(...) Weltgesundheitsorganisation im April! 2020: (...)&quot;  5. &quot;Sie platzte ihre dreijährige Tochter Isabella herein und gesellte sich sehr selbstverständlich dazu&comma; als sie dem Sender Sky News ein Interview gab. &quot; 6. &quot;Dabei vergaß er&comma; die Kamera abzuschalten&comma; und kam unter die Dusche.&quot;,-1,-1,-1,-1,105422,2,,,,,,ae677b58785231a390612727b47401b8,,2,13.279.569.458.961.400,6.612.754.464.149.470,89491,2022-09-21 13:42:59
