comment,blacklist_suggestions,overall_quality,factual_correctness,readability,rating_time,warm_up,user_suggestions,action_coherence,linguistic_difference,content_similarity,identical_information,exhaustive_information,story_edit,story_old,grammar,implicit_fact_check,citation_correct,context_realization,false_gender,false_mood,matches_fandom,positive_comment,positive_example,negative_comment,negative_example,implicit_fc_comment,implicit_fc_example,positive_comment_topic,negative_comment_topic,story_id,listvalue,story_group,length,topk,temperature,likelihood_score,hash,version,amount_fallbacks,duration_generation,dur_score,user,date
-1,-1,50,100,25,23:39,1,-1,100,60,70,100,100,-1,-1,40,50,100,-1,100,100,-1,1. eingefügtes &quot;Aber&quot; zwischen Zitaten inhaltlich passend,1. &quot;Meine Frau Gerlinde ist an Brustkrebs erkrankt&quot;&comma; sagte Kretschmanns persönliche Erklärung. Aber: &quot;Es geht ihr den Umständen entsprechend&comma; aber es kommen nun schwere Zeiten auf sie zu,1. Objekt fehlt im Satz2. implizierter Fehler3. implizierter Fehler4. unpassendes &quot;Aber&quot; zwischen Zitaten,1. Dafür ersetzt Grünen-Landtagsfraktionschef Andreas Schwarz.; 2. CDU-Kultusministerin Susanne Eisenmann will Kretschmann bei der Wahl zum 14. März herausholen.; 3. Der populäre grüne Regierungschef regiert seit fünf Jahren als Juniorpartner der CDU.; 4.  &quot;Es gibt Momente&comma; in denen die Politik in den Hintergrund rückt&quot;&comma; sagte Eisenmann beim Freitag. Aber: &quot;Dass Gerlinde Kretschmann an Brustkrebs erkrankt ist&comma; macht mich betroffen. ,-1,-1,-1,-1,105375,1,,,,,,2491f2ebbe2f0866add57122b75ad0b1,,0,4.321.849.179.267.880,18.696.088.552.474.900,12802,2022-09-24 10:52:48
-1,-1,50,100,100,2:1,1,-1,100,60,100,100,100,-1,-1,80,100,100,-1,100,100,-1,-1,-1,-1,-1,-1,-1,-1,-1,105470,3,,,,,,4fcda10a7b31489fd1b3ee398c2c677a,,0,16.579.851.627.349.800,13.931.905.746.459.900,12802,2022-09-24 10:54:51
-1,-1,70,100,75,11:21,1,-1,100,70,90,100,100,-1,-1,50,75,100,-1,-1,100,-1,-1,-1,1. zwei Mal &quot;Jahre&quot; falsch dekliniert2. falsche Großschreibung nach Semikolon3. Genusfehler und Faktenfehler im letzten Satz,1. Nach neuer Anschuldigung drohen der in Belarus (Weißrussland) inhaftierten Oppositionsführerin Maria Kolesnikowa bis zu zwölf Jahren Haft. / Darauf stünden bis zu zwölf Jahren Haft&comma; hieß es.; 2. [...] Hunderte wurden verletzt und mehrere getötet; Nach 26 Jahren an der Macht hatte sich [...]; 3. Die EU erkennt die 66-Jährige nicht als Präsidenten an. ,-1,-1,-1,-1,105364,1,,,,,,83e7cc987210b4a4ddc49e22a9b97db8,,0,494.972.984.790.802,22.771.830.320.358.200,12802,2022-09-24 11:06:13
-1,-1,70,100,100,10:32,1,-1,100,80,100,100,100,-1,-1,80,100,100,-1,100,100,-1,-1,-1,-1,-1,-1,-1,-1,-1,105412,2,,,,,,fd44a6be42223b4dada11d14b10d2f49,,0,30.564.244.985.580.400,15.554.382.085.800.100,12802,2022-09-24 11:16:48
-1,-1,60,100,100,19:11,0,-1,100,60,90,100,100,-1,-1,50,100,90,-1,100,100,-1,-1,-1,1. doppelte Anführungszeichen am Ende eines Zitats2. nach Satzumstellung ist der ursprüngliche Satzanfang&comma; der jetzt mitten im Satz steht&comma; fälschlicherweise großgeschrieben (und Grammatikfehler im letzten Teil des Satzes)3. &quot;n / &quot; nach Zitat,2. Am Freitag stimmte Zwei Wochen nach dem Bundestag auch dem Bundesrat ein entsprechendes Gesetz zu.; 3. [...] Strom zunehmend über weite Strecken zu transportieren.&quot; n / Die Netzausbauvorhaben&comma; für die [...],-1,-1,-1,-1,105486,3,,,,,,5192b1f6ea3b0d4f81c30baebf55cab5,,0,4.580.627.465.248.100,4.177.520.775.794.980,12802,2022-09-24 11:36:01
-1,-1,60,100,75,19:56,1,-1,100,60,90,100,100,-1,-1,80,100,100,-1,100,100,-1,-1,-1,2. Präposition3. Wieso ein Demonstrativpronomen?4. best. Artikel Ausdruck,2.  Die Feuerwehr twitterte &quot;Das Feuer ist seit 11:30 Uhr aus&quot; mit dem Freitag. 3. Diese Warnmeldungen seien zurückgezogen worden. 4. Der Mitarbeiter einer Energieversorgungsfirma wurde leicht verletzt. ,-1,-1,-1,-1,105442,3,,,,,,3710514ff75c549c67c6fb9793cb6fe8,,0,2.065.377.378.463.740,17.409.584.522.247.300,50504,2022-09-24 11:39:36
-1,-1,40,100,75,3:58,1,-1,100,70,80,100,100,-1,-1,50,100,100,-1,100,-1,-1,-1,-1,1. Satzstellung2. Ausdruck&comma; Modus&comma; G&R3. Falsche und unnötige Präp. ,1. Ein Bayreuther Friseur will diesen jetzt für den guten Zweck versteigern&comma; weil der Andrang auf seinen ersten Termin nach dem Lockdown riesig ist. 2. Anschließend soll Nuissl vom Schlussgebot an die Tafel Bayreuth und eine Hilfsorganisation spendet werden. 3. Das höchste Gebot war am frühen Freitagnachmittag mit 282 Euro. ,-1,-1,-1,-1,105399,2,,,,,,8821238f249c04e38bd79ba33caa2706,,0,30.208.345.890.045.100,14.654.225.826.263.400,50504,2022-09-24 12:06:37
-1,-1,20,100,25,6:31,1,-1,100,60,80,100,100,-1,-1,0,75,100,-1,100,-1,-1,-1,-1,1. Nebensatz quasi ausgegliedert aus dem Hauptsatz2. Ausdruck3. &quot;man&quot; fehlt oder Ausdrucksfehler &quot;wurde eingewiesen&quot;4. vollkommenes Chaos&comma; bei dem manmit G&R spekulativ rekonstruieren muss5. Modusfehler und Präposition 6. Kleinschreibung Adjektiv,1. Früherer Direktor des Internationalen Währungsfonds (IWF) In Spanien 4. Ende Oktober 2018 hatte Rato in das Gefängnis von Soto del Real rund 40 Kilometer nördlich von Madrid eingewiesen. 4. Im Strafprozess wegen des Börsengangs der spanischen Großbank Bankia&comma; zusammen mit allen 33 weiteren Beschuldigten vom Vorwurf des Betrugs der Anleger und der Bilanzfälschung freigesprochen worden&comma; war ihm im vorigen Oktober offener Vollzug gewährt worden 5. Nach dem Börsengang bei Bankia im Jahr 2011 hätten rund 200.000 Kleinanleger herbe Verluste erlitten.  6. Sie wurde 2012 Teilverstaatlicht   2. bei dem Gericht ,-1,-1,-1,-1,105340,1,,,,,,09581ebac00f61f17a018f10652dd6f1,,0,8.057.249.975.204.460,53.225.659.132.003.700,50504,2022-09-24 12:50:18
-1,-1,40,100,0,3:49,1,-1,75,60,80,100,100,-1,-1,90,75,100,-1,100,100,-1,-1,-1,1. &quot;er&quot; fehlt2. Ausdruck3. Ausdruck unbestimmter Artikel4. Wegen Satzstellung Lokale Kohärenz / IFC / IA5. Ausdruck ,1.  jetzt ist sein Führerschein los 2. Polizeidienst 3. Ein 56-Jähriger musste seinen Führerschein abgeben. 5. Der Mann werde vorerst noch nicht einmal zum Winterdienst eingesetzt. ,-1,-1,-1,-1,105417,2,,,,,,68494c0e157fa72ed23673d43c080da1,,0,30.197.975.635.528.500,16.864.835.023.880.000,50504,2022-09-24 12:54:08
-1,-1,60,100,50,32:18,1,-1,100,50,90,100,100,-1,-1,70,75,100,-1,100,-1,-1,-1,-1,1. Ausdruck2. Ausdruck fehlender Passiv und Modus3. Satzzeichen4. falsche Präposition,1.  für dieses Jahr  2. Die 39. Ausgabe des Festivals (24. April bis 2. Mai) sollte 22 Werke des 81-Jährigen zeigen. 3.  &quot;Die Blechtrommel&quot; (&quot;Homo Faber&quot;) 4. an welcher Form Schlöndorff,-1,-1,-1,-1,105477,3,,,,,,fd116f160d9b19a41f75e3fa52e8ec63,,0,19.457.018.613.815.300,1.616.882.586.479.180,50504,2022-09-24 13:31:42
-1,-1,60,100,75,2:16,1,-1,100,60,80,100,100,-1,-1,90,75,100,-1,100,100,-1,-1,-1,1. Präposition2. Ausdruck IFC&comma; IA,1.  mit den Modellen X3&comma; X4&comma; X5&comma; X6 und X7 2. Das SUV-Werk Spartanburg zählt zu den wichtigsten Exportländern China (23 Prozent)&comma; Deutschland (13 Prozent)&comma; Südkorea&comma; Kanada und Russland. ,-1,-1,-1,-1,105351,1,,,,,,080ead32bcb063de1ce0ab62b1271c89,,0,2.390.624.451.637.260,15.216.270.208.358.700,50504,2022-09-24 13:33:59
-1,-1,70,100,25,22:48,0,-1,75,60,90,100,100,-1,-1,80,100,100,-1,100,100,-1,-1,-1,1. Satzteil als eigenständiger Satz2. Ausdruck Satzstellung und LKH3. Ausdruck4. Ausdruck. Hier fehlt eigentlich ein bestimmter Artikel,1. 2020 an. 2. Das türkische Parlament muss dem noch zustimmen&comma; weil China im Dezember ein ursprünglich im Jahr 2017 geschlossenes Abschiebeabkommen beider Länder verabschiedet hatte. 3. Und: &quot;Ich 4. Die chinesische Botschaft in Ankara hatte Vorwürfe von Uiguren am Montag als &quot;Lügen und Verleumdung&quot; zurückgewiesen. ,-1,-1,-1,-1,105374,1,,,,,,13a28ddb0ce43aaaa123292303d5ee6b,,0,41.891.475.200.653.000,1.733.082.914.352.410,50504,2022-09-24 13:56:49
-1,-1,50,100,75,40:5,0,-1,100,70,90,100,100,-1,-1,40,100,100,-1,100,100,-1,-1,-1,1. Hilfsverb &quot;worden&quot; fehlt2. Ausdruck &quot;gab bekannt&quot; und Großschreibung3. Tempus4. G&R,1. Der Start der deutschen Snowboardcrosser in den Teamwettbewerben der Weltmeisterschaften ist kurzfristig abgesagt. 2. Das sagte Snowboard Germany Wenige Stunden vor den Starts bekannt. 4.  sagt Cheftrainer Bernard Loer.  5.  Das deutsche Team hatte vor zwei Jahren Paul Berg und die derzeit verletzte Hanna Ihedioha WM-Bronze geholt,-1,-1,-1,-1,105400,2,,,,,,f09ae9eee3eba998f18eeee777f6a3e3,,1,27.892.231.225.967.400,14.776.250.839.233.300,50504,2022-09-24 14:37:04
-1,-1,10,100,75,17:11,0,-1,-1,60,90,100,75,-1,-1,0,75,100,-1,100,100,-1,-1,-1,1. erneut Satzteil außerhalb des Satzes2. Geht irgendwie sogar&comma; aber Ausdruck nicht ideal und eigentlich IFC&comma; da es jetzt die Gegner des Trainers sind3. Doppelpunkt fehlt4. &quot;Spielen&quot; fehlt&comma; also Vollständigkeit und G&R5. Satzzeichen6. &quot;Sieg gegen&quot; fehlt7. Verb fehlt8. Präp. &quot;in der Startelf&quot;9. Kasus,1. Eintracht s.  2.  Die Gegner von Frankfurts Trainer Adi Hütter 3. Der Österreicher sagte auf der Online-Pressekonferenz am Freitag &quot;Alle wollen uns jetzt schlagen&quot;.  4. Mit sieben Siegen aus acht haben die Hessen 5. erarbeitet&quot; / so Hütter. 7. Aymen Barkok fortan wieder einsatzbereit. 8.  Ob er gleich für die Startelf steht  9. dem Portugiesen André Silva im Sturm,-1,-1,-1,-1,105478,3,,,,,,938bfce7972d7f0cb3dc3d1459f259b3,,0,28.751.121.997.833.200,2.508.334.708.213.800,50504,2022-09-24 14:54:20
-1,-1,80,100,50,2:33,0,-1,100,80,90,100,100,-1,-1,90,100,100,-1,100,100,-1,-1,-1,1. Ausdruck2. Reflexivpronomen fehlt3. Ausdruck,1. Aber: &quot; 2. Das hänge aber unter anderem davon ab&comma; wie stark die Mutationen in Deutschland ausbreiteten. 3. Aber: &quot; ,-1,-1,-1,-1,105388,1,,,,,,78e70b1d3fc35bfb0432f1f81ed8f043,,0,3.542.972.230.911.250,13.612.686.157.226.500,50504,2022-09-24 14:56:55
-1,-1,70,100,75,2:2,0,-1,75,50,90,100,100,-1,-1,80,100,100,-1,100,100,-1,-1,-1,1. Leerzeichenfehler (2x im Text)2. Ausdruck Adverb > LKH,1. &quot;Spiegel&quot; -Bericht  2.  weil sie nach der Prioritätenliste nicht an der Reihe waren,-1,-1,-1,-1,105397,2,,,,,,62dd4277bd1edebe5415d68b2dced05b,,0,20.092.352.867.126.400,7.202.167.272.567.740,50504,2022-09-24 14:58:59
-1,-1,50,100,25,37:48,0,-1,100,60,80,100,100,-1,-1,60,75,100,-1,100,100,-1,-1,-1,1. G&R: Position Komma&comma; Satzstellung&comma; Präpposition 2. Doppeltes AFZ3. Ausdruck &quot;keine&quot;4. Ausdruck Satzstellung&comma; IFC&comma; IFC (die Belegschaft wird vor Einschnitten in der Rente&comma; nicht in der Belegschaft gewarnt)5. Ausdruck &quot;keine&quot;,1. wettbewerbsfähig aufzustellen&quot; in Rüsselsheim&comma; sagte ein Opel-Sprecher dem Freitag. 2. Bereich.&quot;&quot; 3.  Es sei noch nicht eine endgültige Entscheidung gefallen 4. warnte der Betriebsrat nun vor Einschnitten in der Belegschaft in einem Schreiben.  5. und nicht eine garantierte Verzinsung von fünf Prozent geben. ,-1,-1,-1,-1,105456,3,,,,,,9ad5d761dfc236003b4e64659909d7bc,,0,21.421.374.559.402.400,17.486.518.144.607.500,50504,2022-09-24 15:36:48
-1,-1,70,100,75,2:4,0,-1,100,50,90,100,100,-1,-1,80,100,100,-1,100,100,-1,-1,-1,1. Komma fehlt2. falsche Präposition3. Ausdruck best. Artikel fehlt,1. offener&quot; sagte die 26-Jährige 2. weil das Training und die Anforderungen etwas anders seien als bei Deutschland. 3. gegen Niederlande,-1,-1,-1,-1,105480,3,,,,,,2ad803260811a2f310c0deda8913a50f,,0,17.867.244.720.458.900,14.557.568.311.691.200,50504,2022-09-24 15:38:54
-1,-1,60,100,100,1:51,0,-1,100,60,90,100,100,-1,-1,70,100,90,-1,100,100,-1,-1,-1,1. Präposition2. direktes Zitat verfälscht und ohn AFZ,1.  vom Freitag 2.  Wenn man dir einen anderen Verein&comma; einen Spieler oder einen Trainer wegholt&comma; dann könne man natürlich einen Groll haben,-1,-1,-1,-1,105355,1,,,,,,c02cf7be411540ea908fae1e6ca115fb,,0,24.323.166.847.229.000,9.740.926.742.553.710,50504,2022-09-24 15:40:46
-1,-1,80,100,75,1:31,0,-1,100,40,100,100,100,-1,-1,100,100,100,-1,100,100,-1,-1,-1,1. Ausdruck Einleitung direkte Rede,1. Und: &quot;Aber ,-1,-1,-1,-1,105423,2,,,,,,a0044d21e2906d5720d3195ded5c14ef,,1,34.023.295.640.945.400,1.499.060.869.216.910,50504,2022-09-24 15:42:19
-1,-1,50,100,50,3:37,0,-1,75,70,80,100,75,-1,-1,100,75,100,-1,100,100,-1,-1,-1,1. Ausdruck Wiederholung &quot;jedoch&quot;2. Aufgrund Satzstellung (hier nur Ausdruck) und Weglassung &quot;Verkehrsdaten&quot; (Vollständigkeit)&comma; auch LK&comma; IFC und IA,1. Das Gesetz musste jedoch geändert werden&comma; weil das nur noch bei einer konkret drohenden Gefahr zulässig ist&comma; entschieden die Karlsruher Richter jedoch. 2. Bestandsdaten&comma; aus denen zum Beispiel ersichtlich ist&comma; wer wann mit wem telefoniert hat&comma; umfassen keine Inhalte etwa von Anrufen oder E-Mails. ,-1,-1,-1,-1,105383,1,,,,,,bc4277a8b1337a863239231b476d8d07,,0,3.262.678.575.515.740,13.065.363.883.972.100,50504,2022-09-24 15:46:07
-1,-1,40,100,75,4:25,0,-1,100,60,80,100,75,-1,-1,40,75,100,-1,-1,100,-1,-1,-1,1. Präposition &quot;mit der&quot; fehlt2. Vollständigkeit und G&R 3. Genus4. Ausdruck feststellen / klarstellen&comma; IFC/IA5. G&R&comma; wenn man den Satz rekonstruiert,1. Ungarn hat als bislang einziges EU-Land die Verabreichung des russischen Covid-19-Impfstoffes Sputnik V begonnen. 2. Ungarn zählt fast zehn Millionen. 3.  sie weltweit bereits mindestens einer Million Menschen verabreicht wurde. 4. Außenminister Peter Szijjarto stellt das Vorliegen der Bedingungen klar. 5. Ungarns südlicher Nachbar Serbien&comma; ein EU-Kandidatenland&comma; der bereits seit Wochen Sputnik V und Sinopharm einsetzt. ,-1,-1,-1,-1,105441,3,,,,,,a0610dda65be20d68b56e8e8dc66ed6b,,0,3.457.465.648.651.120,29.719.374.179.840.000,50504,2022-09-24 15:50:34
-1,-1,100,100,100,0:59,0,-1,100,60,100,100,100,-1,-1,100,100,100,-1,100,100,-1,-1,-1,-1,-1,-1,-1,-1,-1,105393,2,,,,,,acd2a44b7089d38069dcb7565f5045e3,,0,23.619.109.630.584.700,875.697.946.548.462,50504,2022-09-24 15:51:35
-1,-1,70,100,0,3:8,0,-1,75,70,90,100,100,-1,-1,90,100,100,-1,100,100,-1,-1,-1,1. Ausdruck2. Ausdruck3. Ausdruck Satzstellung und dadurch LKH4. Ausdruck5. doppeltes AFZ,1. ...&comma;  ist im gemeinsamen Beschluss die Rede. 2.  Und: &quot;Also 3. Längerfristig stimmte Seibert die Menschen in Deutschland auf eine noch unsichere Perspektive weiterer Öffnungen ein und machte mit Blick auf den Sommer deutlich&comma; wenn mehr Menschen als heute geimpft sein sollten. 4.  Aber: &quot; 5. werden.&quot;&quot; ,-1,-1,-1,-1,105438,2,,,,,,d76925e01aa7a0ef68fa203e052608f3,,0,3.772.731.161.117.550,15.368.133.544.921.800,50504,2022-09-24 15:54:44
-1,-1,80,100,75,1:56,0,-1,100,60,90,100,100,-1,-1,90,100,100,-1,100,100,-1,-1,-1,1. Hilfsverb &quot;werden&quot; fehlt&comma; also G&R2. Ausdruck &quot;hätte&quot;,1. Dabei sei der Schädelknochen um zwei Zentimeter nach innen gedrückt und gebrochen. 2.  Am Donnerstag hätte das Kind notoperiert werden müssen. ,-1,-1,-1,-1,105385,1,,,,,,af0dc6a17264c50df8def44b61f23160,,0,26.398.294.925.689.600,14.323.066.711.425.700,50504,2022-09-24 15:56:42
-1,-1,70,100,75,2:27,0,-1,100,70,90,100,100,-1,-1,90,100,100,-1,100,100,-1,-1,-1,1. Ausdruck anrufen&comma; obwohl es in diesem Kontext sogar noch irgendwie geht2. G&R Konjunktion Verb,1. den Vermittlungsausschuss anrufen zu lassen&comma;  2. wie die Karlsruher Richter entschied,-1,-1,-1,-1,105483,3,,,,,,dda9c9fd94e35ddbd14ccb599ae8db2b,,0,23.309.046.030.044.500,19.146.910.905.838.000,50504,2022-09-24 15:59:10
-1,-1,60,100,75,5:3,1,-1,100,60,90,100,100,-1,-1,80,100,100,-1,100,100,-1,-1,-1,1. unklare Formulierung,1. Gut 53 Prozent der Stammaktien hält die PSE an. ,-1,-1,-1,-1,105343,1,,,,,,96667c95a9f351313f869716571bec48,,0,2.583.570.909.500.120,10.271.106.958.389.200,12802,2022-09-25 08:36:20
-1,-1,50,100,100,4:39,1,-1,75,60,90,100,100,-1,-1,80,100,100,-1,100,100,-1,-1,-1,1. unschöne Formulierung2. unklare Formulierung,1. Das Kind habe alles gut überlebt und werde keine bleibenden Schäden davontragen&comma; ging Dohna-Schwake am Freitag davon aus.; 2. Die Beobachtung wurde stationär aufgenommen,-1,-1,-1,-1,105435,2,,,,,,8be67d698c059946ae6dca1f07a17e62,,0,24.153.648.138.046.200,12.478.893.995.285.000,12802,2022-09-25 08:41:01
-1,-1,60,100,50,14:57,1,-1,75,60,90,100,100,-1,-1,60,100,90,-1,100,100,-1,-1,-1,1. unschöner Ausdruck und falsch angelegter Redebegleitsatz2. doppelte Anführungszeichen am Ende eines Zitats3. zwei Mal &quot;geben&quot; und Ersetzung von &quot;keine&quot; zu &quot;nicht eine&quot;,1. [...] wettbewerbsfähig aufzustellen&quot; in Rüsselsheim&comma; sagte ein Opel-Sprecher dem Freitag.; 3. Es solle zudem &quot;keine lebenslange Betriebsrente mehr geben&quot; und nicht eine garantierte Verzinsung von fünf Prozent geben,-1,-1,-1,-1,105456,3,,,,,,9ad5d761dfc236003b4e64659909d7bc,,0,21.421.374.559.402.400,17.486.518.144.607.500,12802,2022-09-25 08:56:00
-1,-1,50,100,100,5:9,1,-1,100,50,90,100,100,-1,-1,100,75,100,-1,100,-1,-1,-1,-1,1. impliziter Fehler: falsch eingesetztes &quot;weil&quot; (richtig wäre &quot;obwohl),1. In den Impfzentren&comma; in denen die Truppe derzeit aushilft&comma; erhielten dem Bericht zufolge weitere Soldaten übrig gebliebene Dosen&comma; weil sie nach der Prioritätenliste nicht an der Reihe waren. ,-1,-1,-1,-1,105397,2,,,,,,62dd4277bd1edebe5415d68b2dced05b,,0,20.092.352.867.126.400,7.202.167.272.567.740,12802,2022-09-25 09:01:12
-1,-1,50,75,100,6:45,0,-1,75,70,70,100,100,-1,-1,80,100,90,-1,100,-1,-1,-1,-1,1. falsches Tempus2. Zitationsfehler3. unschöne Satzumstellung4. Faktenfehler (Ortsangaben sind genau andersrum),1. Der Zustand der drei Opfer sei kritisch gewesen.; 2. Nach Angaben des MedStar-Sprechers &quot;Dies ist ein Ereignis&comma; für das unsere Behörden zwar trainieren&comma; wir aber hoffen und dafür beten&comma; dass es nie passiert&quot;.; 3. Mindestens drei kamen laut dem Sender CNN weitere Menschen bei weiteren Unfällen auf spiegelglatten Straßen in Texas ums Leben.; 4. Bei Dallas habe es eine weitere Massenkarambolage mit 26 Autos gegeben&comma; nahe Austin seien 18 ineinander gefahren,-1,-1,-1,-1,105482,3,,,,,,df5f6ecd08664c0470da951de0b0aea0,,0,2.937.604.284.286.490,2.462.659.525.871.270,12802,2022-09-25 09:07:58
-1,-1,50,100,75,9:15,0,-1,100,50,90,100,100,-1,-1,90,75,100,-1,100,100,-1,-1,-1,1. falsche Formulierung2. impliziter Fehler,1. Die Eintracht Frankfurts Trainer Adi Hütter; 2. sagte der Österreicher bei einer Online-Pressekonferenz zum Thema Freitag. ,-1,-1,-1,-1,105378,1,,,,,,bcfa19d7dbfb721b83cb04c7810044b5,,0,2.995.810.103.416.440,15.539.818.048.477.100,12802,2022-09-25 09:17:27
-1,-1,50,100,75,11:38,0,-1,100,70,60,100,100,-1,-1,60,50,100,-1,100,100,-1,-1,-1,1. keine Deckungsgleiche Übernahme der Abkürzungen2. falsches Tempus3. impliziter Fehler4. implizierter Fehler,1. (Az.: VI ZR 210 / 18 unter.a.); 2. Bei dem Pfingstturnier Weisweil in der Region Freiburg soll der Unfall im Juni 2011 passieren.; 3. Eigentlich wollten sich das Landgericht Freiburg und das Oberlandesgericht Karlsruhe an den Folgekosten der Pferdebesitzerin und deren Haftpflichtversicherung beteiligen lassen.; 4. Auch der örtliche Reitverein als Veranstalter hatte dagegen geklagt. ,-1,-1,-1,-1,105352,1,,,,,,41d0922d036b90fe2b2729ee3786bff8,,0,5.618.621.349.334.710,27.166.014.194.488.500,12802,2022-09-25 09:29:08
-1,-1,60,100,75,10:29,1,-1,75,70,90,100,100,-1,-1,40,100,90,-1,-1,100,-1,-1,-1,1. Ausdruck,1. [...] erklärt die Deutsche Wetterdienst (DWD) auf dem Freitag. ,-1,-1,-1,-1,105465,3,,,,,,7610b9135c4fe7b4efc5dff592627d32,,0,353.828.387.260.437,301.285.343.170.166,12802,2022-09-25 10:41:53
-1,-1,70,100,100,7:43,1,-1,100,70,100,100,100,-1,-1,90,100,100,-1,100,100,-1,gelungene Umformulierungen,-1,-1,-1,-1,-1,-1,-1,105394,2,,,,,,c847b438affdd49360df1c8acc8ae445,,0,45.056.488.275.527.900,21.032.799.243.927.000,12802,2022-09-25 10:49:38
-1,-1,70,100,100,13:16,1,-1,100,70,90,100,100,-1,-1,90,75,100,-1,100,100,-1,guter Ausdruck,-1,impliziter Fact Check Fehler,Input: Der seit Sommer 2019 kommissarische Chefredakteur in Göttingen&comma; Christoph Oppermann&comma; wird Chefredakteur der &quot;Wolfsburger Allgemeinen Zeitung&quot; (WAZ)&comma; der &quot;Peiner Allgemeinen Zeitung&quot; (PAZ) und der &quot;Aller-Zeitung&quot; (AZ)&comma; wie es weiter hieß.  Output: Nach Angaben aus Göttingen wird der seit Sommer 2019 kommissarische Chefredakteur&comma; Christoph Oppermann&comma; Chefredakteur der &quot;Wolfsburger Allgemeinen Zeitung&quot; (WAZ)&comma; der &quot;Peiner Allgemeinen Zeitung&quot; (PAZ) und der &quot;Aller-Zeitung&quot; (AZ). ,-1,-1,-1,-1,105431,2,,,,,,2c17b8471918a8a1296ae4033318ef97,,0,22.952.123.165.130.600,10.485.630.750.656.100,70828,2022-09-25 10:59:17
-1,-1,60,100,100,11:14,1,-1,100,60,90,100,100,-1,-1,80,75,100,-1,100,100,-1,-1,-1,1. falsche Großschreibung des usprünglichen Satzanfangs&comma; der jetzt mitten im Satz steht2. oder statt und,1. Nach Beschlüssen des Verwaltungsgerichts in der Hauptstadt können Zwei Berliner Kliniken nun Menschen mit nicht medizinisch dringlichen Erkrankungen behandeln und operieren.; 2. [...] mit hoher Wahrscheinlichkeit als rechtswidrig oder nichtig erwiesen&comma; teilte das Gericht am Freitag mit. ,-1,-1,-1,-1,105421,2,,,,,,d8298c2397085e3373ff055c29c376fc,,0,29.055.572.748.184.200,12.894.524.097.442.600,12802,2022-09-25 11:02:56
-1,-1,60,100,75,13:59,1,-1,75,70,90,100,100,-1,-1,80,75,100,-1,100,100,-1,viele Umstellungen,-1,sprachliche Fehler,Für den April mit Zinsen soll C&A nun die Miete nachzahlen,-1,-1,-1,-1,105363,1,,,,,,47d7559f0101947b246cc4175eebd04a,,0,57.734.073.638.916.000,27.864.880.561.828.600,70828,2022-09-25 11:13:17
-1,-1,50,100,50,19:6,1,-1,100,60,70,100,100,-1,-1,70,50,100,-1,100,100,-1,-1,-1,1. Ausdruck2. Ausdruck3. impliziter Fehler4. oder statt und5. Semikolon am Satzende,1. Pandemie setze unverändert fort.; 2. Alle müssten sich an einem Strang setzen.; 3. Bis Ende 2022 soll der ermäßigte Mehrwertsteuersatz von 7 Prozent auf Speisen in Gaststätten und Cafés entfallen. ; 4. Zudem will die große Koalition Firmen ermöglichen&comma; Verluste aus den Corona-Jahren 2020 oder 2021 umfangreicher mit vorherigen Gewinnen zu verrechnen. ; 5. Die Spitzen von Union und SPD hatten die Pläne in der vergangenen Woche vereinbart; ,-1,-1,-1,-1,105361,1,,,,,,203c11cd2f05321b3686fc4db12134af,,0,33.794.536.113.739.000,15.540.894.508.361.800,12802,2022-09-25 11:22:04
-1,-1,60,100,75,3:1,0,-1,75,70,90,100,100,-1,-1,80,100,100,-1,100,100,-1,-1,-1,1. Ausdruck2. Bezug ist hier durch Satzumstellung nicht mehr ganz klar,1. Nach mehreren schweren Schlittenunfällen für Kinder [...]; 2. Vom Fall eines Grundschulkindes aus Essen berichtete der Kinderintensivmediziner Christian Dohna-Schwake am Freitag&comma; gegen dessen Kopf ein Schlitten nach dem Sturz geprallt war. ,-1,-1,-1,-1,105485,3,,,,,,58ffff721a6e9c149b6c05903907ad44,,0,20.755.704.879.760.700,17.849.100.828.170.700,12802,2022-09-25 11:25:06
-1,-1,70,100,75,13:39,1,-1,100,70,100,100,100,-1,-1,90,100,100,-1,100,100,-1,keine inhaltlichen Fehler,-1,sprachlicher Fehler,Dort bauen gut 11.000 Mitarbeiter die Modelle X3&comma; X4&comma; X5&comma; X6&comma; X7. Die wichtigsten Exportländer des SUV-Werks Spartanburg sind China (23 Prozent)&comma; Deutschland&comma; 13 Prozent&comma; Südkorea&comma; Kanada und Russland; ,-1,-1,-1,-1,105401,2,,,,,,e3e125aa094d302076bbd00275b2a859,,0,2.314.847.731.590.270,14.796.672.582.626.300,70828,2022-09-25 11:26:59
-1,-1,60,75,100,5:28,0,-1,75,80,80,100,100,-1,-1,70,75,100,-1,100,-1,-1,-1,-1,1. unklarer Bezug zu Beginn des Satzes2. impliziter Fehler3. expliziter Fehler,1. Ein Bayreuther Friseur will diesen jetzt für einen guten Zweck versteigern&comma; weil der Andrang zum ersten Termin nach dem Lockdown groß ist.; 2. Nach dem ersten freien Termin im 1. März wurde immer wieder um 8.00 Uhr gefragt&comma; [...]; 3. Das höchste Gebot lag am frühen Freitagnachmittag unter 282 Euro,-1,-1,-1,-1,105449,3,,,,,,d2a151056d235377a82aabedec5a9ece,,0,24.016.291.856.765.700,20.065.550.804.138.100,12802,2022-09-25 11:30:40
-1,-1,50,100,75,13:13,1,-1,75,70,70,100,100,-1,-1,80,75,100,-1,100,100,-1,viele Umstellungen,-1,sprachliche Fehler, In der Länderkammer signalisierte eine Vertreterin der Bundesregierung Kompromissbereitschaft im Freitag,-1,-1,-1,-1,105444,3,,,,,,cda5e07846f9b7a4d0df5200bd37a3f1,,0,3.560.109.090.805.050,30.185.426.950.454.700,70828,2022-09-25 11:40:16
-1,-1,60,100,50,21:5,0,-1,100,70,100,100,100,-1,-1,60,100,100,-1,100,100,-1,keine inhaltlichen Fehler,-1,sprachliche Fehler,Input: &quot;Wir sind für ein freies Europa&quot;&comma; aber in der Pandemie müsse die Sicherheit oben stehen&comma; sagte er am Freitag in seiner Regierungserklärung im bayerischen Landtag in München.  Output: In seiner Regierungserklärung im bayerischen Landtag in München sagte er am Freitag&comma; &quot;Wir sind für ein freies Europa&quot; müsse die Sicherheit in der Pandemie oben stehen. ,-1,-1,-1,-1,105459,3,,,,,,8eeee4edc7c506a42c71dbbeba38dd00,,0,5.098.191.165.924.070,4.333.932.304.382.320,70828,2022-09-25 12:01:22
